video_id,title,channel_title,views,likes,dislikes,comment_count,category_name,year,month,month_num,day,hour
xp0m08eOD5U,Moby - Like A Motherless Child (Official Video),Moby,200958,6447,238,384,Music,2017,December,12,Monday,15
6wpb3YfXGqU,MY BEST ADVICE TO MY YOUNG SELF,ilikeweylie,84450,4171,46,402,Howto & Style,2017,December,12,Tuesday,1
fO8pPjlFtNw,Trying to Make a Wireless Lavalier Microphone,ElectroBOOM,316907,18642,249,1409,Science & Technology,2017,December,12,Monday,17
A8HLnDP6uRM,Visit with Santa Cold Open - SNL,Saturday Night Live,2935898,28777,4642,3742,Entertainment,2017,December,12,Sunday,8
I-xZz2OabW0,Robert Mueller obtains Trump transition emails,CNN,402081,3582,1650,5251,News & Politics,2017,December,12,Sunday,11
1iGBHh1q0Kg,Man Rescues Raccoon Choking From Car Tarp | The Dodo,The Dodo,235293,9939,232,1056,Pets & Animals,2017,December,12,Sunday,0
EajOkkJ80uc,Ruby Rose Bought Her Mom a Giant Killer Pig,The Tonight Show Starring Jimmy Fallon,448835,5808,556,1202,Comedy,2017,December,12,Saturday,12
w-TSI1O4yGM,"Top 10 Plays of the Night: December 16, 2017",NBA,384829,4431,498,564,Sports,2017,December,12,Sunday,8
v_5qKt7M5fM,Star Wars The Last Jedi Scores An A Cinemascore And 2nd Largest Opening Ever - The John Campea Show,John Campea,33929,1075,160,894,Entertainment,2017,December,12,Saturday,18
8d_202l55LU,The FCC repeals its net neutrality rules,Washington Post,1263104,5930,132439,23543,News & Politics,2017,December,12,Thursday,18
nPtNK9kitO4,John Boyega and Oscar Isaac Read Hilarious Thirst Tweets,BuzzFeedVideo,373253,14688,117,455,Entertainment,2017,December,12,Thursday,16
BR7AnZ3S8u8,A Federal Judge In Philadelphia Blocks President Trump's Birth Control Restrictions | TIME,TIME,12039,112,91,253,News & Politics,2017,December,12,Friday,22
IC_lnyn2R2Q,THE 15:17 TO PARIS - Official Trailer [HD],Warner Bros. Pictures,967640,6348,356,788,Entertainment,2017,December,12,Wednesday,14
IMzf3C34NNM,"This Man Has Comforted Over 1,200 Newborns",Great Big Story,57738,3634,10,209,People & Blogs,2017,December,12,Thursday,7
-W6v2_0evUU,Why this elbow is a TIME person of the year,Vox,485433,19128,1622,1278,News & Politics,2017,December,12,Wednesday,12
sukhhtHWgko,Jennifer Hudson: “Burden Down” - The Voice 2017,The Voice,305524,7876,150,785,Entertainment,2017,December,12,Wednesday,2
szTpLSf9QhY,Animating and junk,Katzun,34156,2948,18,235,People & Blogs,2017,December,12,Thursday,4
XsVy4ImgM0o,Have Yourself A Merry Little Christmas (ft. Tori Kelly) - Jacob Collier,Jacob Collier,150880,10110,110,669,Music,2017,December,12,Tuesday,20
PKa01AvSATE,WATCH: AL Democratic Senate candidate Doug Jones speaks on election night,PBS NewsHour,38447,819,173,0,News & Politics,2017,December,12,Wednesday,4
BWJY1na9qao,SURPRISED HER WITH THIS....,Carly and Erin,96485,8650,94,498,Comedy,2017,December,12,Wednesday,2
kzFHjyysXr0,Embarrassing Vision Boards From Our Past (ft. Jenna Dewan Tatum),IISuperwomanII,1310346,95629,1292,6064,Comedy,2017,December,12,Tuesday,23
8qL4lMQQ9IE,Star Wars: The Last Jedi - Movie Review,Chris Stuckmann,1039254,37041,4355,11238,Entertainment,2017,December,12,Tuesday,17
wd8h1iND_ys,My House is Still Burned Down,William Osman,406438,31401,346,2773,Science & Technology,2017,December,12,Tuesday,17
h-h5Mhlt6O0,iMac Pro: 1 Week Impressions!,Marques Brownlee,1845803,82929,2105,8134,Science & Technology,2017,December,12,Tuesday,14
1PhdQdJjDZc,Predators' Subban scores fluttering goal after turnover by Canucks' Del Zotto,SPORTSNET,12591,57,4,8,Sports,2017,December,12,Thursday,3
_JhaVNJb3ag,Heart-Wrenching Video: Starving Polar Bear on Iceless Land | National Geographic,National Geographic,792814,12441,1837,5493,Pets & Animals,2017,December,12,Monday,18
QXcbVHFE2bo,How-To Make Chocolate Mousse with Matty Matheson,Munchies,442698,14407,229,582,Entertainment,2017,December,12,Tuesday,12
ZeGNvhAsUW8,Ellie Goulding - O Holy Night (Audio),EllieGouldingVEVO,169934,11759,305,894,Music,2017,December,12,Wednesday,0
MyAnv1nY5Vw,"Keaton Jones, 11: I Hope My Viral Anti-Bullying Video Helps Other Kids | TODAY",TODAY,72365,464,891,522,News & Politics,2017,December,12,Tuesday,15
skFCPu6elew,WOODY WOODPECKER Trailer #1 NEW (2018) Live Action Comedy Movie HD,MovieAccessTrailers,20636,213,55,51,Entertainment,2017,December,12,Wednesday,17
kz1xzBYppW8,Heartbreaking video of schoolboy Keaton Jones recounting being bullied,Guardian News,1364148,12058,3301,5815,News & Politics,2017,December,12,Monday,8
khPLWaBioOs,Logan Paul - SANTA DISS TRACK (Official Music Video),Logan Paul Vlogs,18938867,1013411,140271,175929,Entertainment,2017,December,12,Sunday,21
SbnJwF7GrWg,STAR WARS - REY'S PORTION BREAD - MUG CAKE RECIPE - NERDY NUMMIES,Rosanna Pansino,411284,21003,251,2877,Howto & Style,2017,December,12,Tuesday,17
Jq_98dJuIck,Star Wars: The Last Jedi Review (SPOILER FREE),IGN,607251,12787,1574,2251,Entertainment,2017,December,12,Tuesday,17
sVfTvLm-7Ac,HIGHLIGHTS: MK Dons U18s 1-0 Cardiff City U18s,MK Dons,20618,30,0,2,Sports,2017,December,12,Wednesday,16
7l2NnC0MNt4,"'Riverdale' S2E09 'Silent Night, Deadly Night' PRESHOW | Sweetwater Secrets",Entertainment Tonight,43221,1129,13,274,Entertainment,2017,December,12,Wednesday,17
dI5IxmA19jw,OPTICAL ILLUSION: Jaw-dropping Diamonds,greeenpro,11439,63,11,10,Science & Technology,2017,December,12,Tuesday,20
VWFoCcbXqAw,Greg talks with  the school shooter who killed his son 25 years ago | StoryCorps,StoryCorps,35247,775,33,102,Film & Animation,2017,December,12,Tuesday,19
rRzxEiBLQCA,TWICE Heart Shaker M/V,jypentertainment,41088994,956937,91898,157207,Music,2017,December,12,Monday,8
WOUZxG1JcGI,What It's Like To Be Absolutely Obsessed With Bitcoin (HBO),VICE News,747672,5966,1173,1188,News & Politics,2017,December,12,Tuesday,1
Gjs1QSa9fpI,Testing BLADE VORTEX Interactions with Devin Supertramp,JerryRigEverything,114266,5555,159,621,Howto & Style,2017,December,12,Wednesday,15
KKwmGuQaMfo,EPIC DIY Gingerbread House for Cats!,Cole and Marmalade,99681,10091,49,1256,Pets & Animals,2017,December,12,Tuesday,18
ERBEwrn4f7Q,"Kids Interview The 'Star Wars: The Last Jedi' Cast With Daisy Ridley, Mark Hamill & More | PeopleTV",PeopleTV,319546,6238,124,520,Entertainment,2017,December,12,Monday,22
32YGGYaUTgE,Fighting California's Wildfires: Stunning Footage from the Front Lines,The Atlantic,23910,208,8,42,Film & Animation,2017,December,12,Tuesday,16
iCXQwI2Luw8,“Santa Baby” ft. Ciara | TARAJI’S WHITE HOT HOLIDAYS,Empire,26129,628,9,35,Entertainment,2017,December,12,Tuesday,19
Wl7V4LwkfQE,The Perfect iMac Pro Setup!,Jonathan Morrison,351539,11850,589,1007,Science & Technology,2017,December,12,Tuesday,14
OdJh_Q5XY4U,"MAYWEATHER REVEALS COMEBACK OFFER, FIGHTING IN UFC; POPPIN MAD SH*T: THERE'S ONLY ONE GOAT...ME",FightHype.com,285672,2370,521,2877,Sports,2017,December,12,Tuesday,17
dx0jvrlV_EQ,The Maccabeats - Candles on the Sill - Hanukkah,MaccabeatsVideos,205870,2834,86,244,Music,2017,December,12,Monday,20
oFqHvacY9Kk,björk - the gate deconstructed,Björk,71452,5197,48,301,Music,2017,December,12,Tuesday,21
IR8k4uYnTfI,Hacking PIN Codes with a 3D Printer - Hak5 2314,Hak5,11503,304,60,60,Science & Technology,2017,December,12,Wednesday,16
mSgDg1oiOCs,YouTuber Holiday Gift Wrapping (ft. Eva Gutowski & Kyle Krieger),Tyler Oakley,56894,5440,42,1038,Entertainment,2017,December,12,Tuesday,20
-oOlAGKBXnA,I Won't Wear A Jacket,Gus Johnson,1618811,53446,3188,2899,Comedy,2017,December,12,Sunday,23
1w9tf3vSuVs,"Chit Chat GRWM | Failure, Disappointment & Holidays",Shameless Maya,36476,4271,21,710,Howto & Style,2017,December,12,Wednesday,3
MC5bNVTMxyQ,Derailed Amtrak train dangles over highway in Washington,CNN,473026,1800,638,1995,News & Politics,2017,December,12,Monday,17
sgT2Ozn17_c,The Voice 2017 Chloe Kohanski - Finale: “Wish I Didn't Love You”,The Voice,101636,4153,293,629,Entertainment,2017,December,12,Tuesday,2
QerVvvNem1w,OCEAN'S 8 - Trailer Teaser,Warner Bros. Pictures,632993,7802,5669,2930,Entertainment,2017,December,12,Monday,14
hOulcmOHCIQ,White House Tree Trimming Cold Open - SNL,Saturday Night Live,3817594,33825,7731,6281,Entertainment,2017,December,12,Sunday,7
oYvw0GryNs8,Really Offensive Video (ft. Shane Dawson),IISuperwomanII,1629871,159941,2175,12628,Comedy,2017,December,12,Monday,0
KMTJrFPie6w,"Jimmy Fallon, Anna Kendrick, Darlene Love & The Roots Sing Christmas (Classroom Instruments)",The Tonight Show Starring Jimmy Fallon,24032,1739,22,45,Comedy,2017,December,12,Tuesday,4
8bXF29AeVQc,Jack Black | This Week on GMM,Good Mythical Morning,165337,5717,212,613,Entertainment,2017,December,12,Sunday,11
yfxJHGhaECA,Marvin Lewis leaving the Cincinnati Bengals | NFL Countdown | ESPN,ESPN,14967,131,20,93,Sports,2017,December,12,Sunday,18
ZWGh7si0Y50,The Polka King | Official Trailer [HD] | Netflix,Netflix,438167,4163,394,466,Entertainment,2017,December,12,Friday,15
HqXKEgTYZBQ,How the end of net neutrality could change the internet,Vox,1222270,44795,1760,8417,News & Politics,2017,December,12,Friday,12
fZYtg2BTWBI,Star Wars: The Last Jedi Will Have a MASSIVE Opening Weekend - SJU,ScreenJunkies News,56002,1348,136,244,Entertainment,2017,December,12,Friday,20
xLkHEZTSeoU,Casey Neistat Melts His Face Off While Eating Spicy Wings | Hot Ones,First We Feast,3129042,136032,5108,12857,Howto & Style,2017,December,12,Thursday,16
-RUbNqpwOt8,John Cena Answers the Web's Most Searched Questions | WIRED,WIRED,1586396,45690,2414,3812,Entertainment,2017,December,12,Thursday,17
Y0D0s9eIKuw,Mixing All My Tea Together *warning: some tea was spilled*,Simply Not Logical,1627758,98772,670,23395,Entertainment,2017,December,12,Thursday,0
pWqef6cbwzI,ANGRY GRANDPA TRIBUTE VIDEO,TheAngryGrandpaShow,2984785,306711,1836,63948,People & Blogs,2017,December,12,Tuesday,23
HTi1c_tLnqw,Nick Jonas - Home,NickJonasVEVO,869519,46606,634,1472,Music,2017,December,12,Wednesday,15
yI2k6OKsSVw,NURSERY Tour! | Fleur De Force,Fleur DeForce,253874,8854,175,730,Howto & Style,2017,December,12,Wednesday,17
DkXD5949qqQ,You Make It Feel Like Christmas (Live From “Gwen Stefani’s You Make It Feel Like Christ...,GwenStefaniVEVO,331638,4527,352,401,Music,2017,December,12,Wednesday,6
QK0s815RTJk,ANTI SANTA PROTEST GOES BAD,Smosh,637045,26635,972,1734,Comedy,2017,December,12,Wednesday,17
66kn6Dcr12E,Taylor Swift's reputation Stadium Tour - Trailer,Taylor Swift,248200,24531,455,2122,Music,2017,December,12,Wednesday,15
r4ppTbMcFTo,Luke Combs - One Number Away (Lyric Video),LukeCombsVEVO,73525,2332,74,106,Music,2017,December,12,Wednesday,14
Nk5yOFCsNeE,$360 KYLIE COSMETICS BRUSHES TESTED! HONEST AF REVIEW!,Manny Mua,3096627,143831,3274,104113,Howto & Style,2017,December,12,Tuesday,20
tT-lTxhW7pY,Roy Moore Delivers Concession Speech From Alabama (Full) | NBC News,NBC News,201025,625,4786,0,News & Politics,2017,December,12,Wednesday,4
HJqALBKE4r4,Christmas Jumper Cake How-To | Cupcake Jemma,CupcakeJemma,65874,3209,32,120,Howto & Style,2017,December,12,Thursday,18
lYEj9snU838,"Boy speaks out on viral bullying video, mom addresses backlash",CBS This Morning,1363711,9025,17324,9513,News & Politics,2017,December,12,Tuesday,12
8oKl_qDJHt4,How to Hijack Amazon Prime Now for Good,Rob Bliss,1820569,61753,2820,4639,Entertainment,2017,December,12,Tuesday,11
_CZHqpIpN4k,"The Last Jedi Cast Answers YOUR Questions, Behind the Scenes of the Red Carpet Live Stream, & More!",Star Wars,159145,6373,247,785,Entertainment,2017,December,12,Wednesday,21
Id2hMkmcIMA,Ascend Thailand’s Temple of the Rising Dragon,Great Big Story,58278,2182,35,105,People & Blogs,2017,December,12,Thursday,7
DWG2mSSBi8U,Do You Want to Hear a Woke Eminem? | Everyday Struggle,Complex,220398,4541,638,2724,Entertainment,2017,December,12,Wednesday,19
t7Fa1GUf-LE,#LightTheWorld Christmas Concert with The Piano Guys and Friends,ThePianoGuys,249897,9070,146,463,Music,2017,December,12,Tuesday,23
OkvNxYMyips,Disney Officially to Buy 21st Century Fox for $52.4 Billion - IGN News,IGN News,15066,526,61,338,Entertainment,2017,December,12,Thursday,14
P4VipvC54W4,coin cell challenge,Michael Rigsby,1893,8,0,0,People & Blogs,2017,December,12,Wednesday,0
hphLiGW6FgE,'Wonder Woman' Director Patty Jenkins on Picking The Right Project | Close Up With THR,The Hollywood Reporter,31319,632,17,155,Entertainment,2017,December,12,Wednesday,17
3j5eGupDWY4,"Homeless and abused, this Pit Bull didn't lose HOPE that something amazing will happen!",Hope For Paws - Official Rescue Channel,592859,25057,235,1646,Pets & Animals,2017,December,12,Tuesday,17
31Fbv9qRV7s,my wife telling me about her weird dream,austinmcconnell,61584,5719,142,650,Comedy,2017,December,12,Wednesday,16
GSCP2yg-v2g,Everything Wrong With Rogue One: A Star Wars Story,CinemaSins,2019235,52997,3697,9167,Film & Animation,2017,December,12,Tuesday,17
3fArI2PZBUo,Corgi Snowplow,Rainer Hilland,55318,1533,16,80,People & Blogs,2017,December,12,Thursday,14
0bSE-rh7jFg,When the girl you're wrestling has a tough little brother  - 979280,RM Videos,817094,854,31,139,Comedy,2017,December,12,Tuesday,20
0vKkwJwL77Y,Honest Trailers - Star Wars: Episode VI - Return of the Jedi,Screen Junkies,1535652,36776,1758,4414,Film & Animation,2017,December,12,Tuesday,18
DIM6F38ITsY,THE WORLD'S HARDEST SCOOTER TRICK!,Ryan Williams,104773,4056,46,292,Entertainment,2017,December,12,Wednesday,20
stMM0EsoGwY,HOLIDAY GIFT GUIDE 2017 | Jaclyn Hill,Jaclyn Hill,1017290,56899,2108,7449,Howto & Style,2017,December,12,Wednesday,0
Vf76O7y-7pk,Jack Johnson - Only The Ocean,JackJohnsonVEVO,13135,1398,9,106,Music,2017,December,12,Thursday,5
t5Lz14wu1uw,ready player one,ProZD,3180207,77590,7051,5718,Film & Animation,2017,December,12,Monday,19
a7NJ6Gek9v4,ALL TIME GREATEST AIRPLANE SEAT - Emirates First Class Suite,CaseyNeistat,5875258,263740,6570,14042,People & Blogs,2017,December,12,Monday,23
oPM3jxnoqhk,Jennifer Hudson - Burden Down,jenniferhudsonVEVO,506547,17801,531,1182,Music,2017,December,12,Tuesday,15
Y62ExbHI4Yk,What Is The Most Common Crime In Different Countries?,The Infographics Show,530143,11176,1061,2019,Education,2017,December,12,Tuesday,16
9OeZYhjyweQ,When Your Uber Driver Takes a Personal Call,CollegeHumor,502917,17891,631,583,Comedy,2017,December,12,Tuesday,19
yArprk0q9eE,This Particle Breaks Time Symmetry,Veritasium,1026275,51253,747,3396,Education,2017,December,12,Tuesday,15
JiOXpKU7tWc,2017 is the Best?,vlogbrothers,238661,13691,264,977,People & Blogs,2017,December,12,Tuesday,20
lw_KFCgcvA4,3 EVERYDAY LOOKS | Samantha Maria,Samantha Maria,65631,4197,96,170,Howto & Style,2017,December,12,Wednesday,17
eQTcXGk9BRk,Tove Styrke - liability (demo) (Audio),tovestyrkeVEVO,11995,1403,12,107,Music,2017,December,12,Thursday,8
wwX-RSqxEXc,17 of 2017: The Year in Pop Culture (ft. Damon and Jo) | Kingsley,Kingsley,28679,2537,6,192,Entertainment,2017,December,12,Wednesday,20
7ghv9MJHlfs,The Voice 2017 Chloe Kohanski and Billy Idol - Finale: White Wedding,The Voice,78662,1966,172,457,Entertainment,2017,December,12,Wednesday,3
azVAxbETWmk,Anna Kendrick Does Her Impression of Kristen Stewart Talking About Pitch Perfect 3,The Tonight Show Starring Jimmy Fallon,1141627,18848,665,1231,Comedy,2017,December,12,Tuesday,11
mEAZB6QEJwQ,Do you believe Carmelo Anthony? Stephen A. Smith says 'hell no' | First Take | ESPN,ESPN,498117,4293,222,1712,Sports,2017,December,12,Tuesday,16
IJKjMIU55pE,How smart is today's artificial intelligence?,Vox,306095,11726,283,1103,News & Politics,2017,December,12,Tuesday,14
MJGkm0UwNRk,Narcos - Season 4 | Teaser [HD] I Netflix,Netflix,141000,4625,81,546,Entertainment,2017,December,12,Tuesday,16
v9wbMzkVseE,Patriots vs. Steelers | NFL Week 15 Game Highlights,NFL,2336544,19462,4484,15699,Sports,2017,December,12,Monday,0
BBQ-2BUGQv8,Star Wars: The Last Jedi Has Second Largest Opening Ever Amidst Mixed Fan Reactions - Movie Talk,ColliderVideos,92355,2641,270,1286,Entertainment,2017,December,12,Monday,18
plnzNgtvvJo,You'll Shoot Your Eye Out Performance | A CHRISTMAS STORY LIVE,FOX,62264,511,463,239,Entertainment,2017,December,12,Monday,4
KiAdIPw_QCk,"Keeping Up With the Kardashians Katch-Up S14, EP.11 | E!",E! Entertainment,343524,2203,320,183,Entertainment,2017,December,12,Monday,2
b9lb2x_OHOk,Guess The Voice - Animation Challenge With Brian Hull,itsAlexClark,412649,9687,1207,1670,Film & Animation,2017,December,12,Saturday,14
noUH5aYUBx4,FCC Votes to Repeal Net Neutrality; Omarosa Drama Continues: A Closer Look,Late Night with Seth Meyers,2654222,29306,2643,3650,Comedy,2017,December,12,Friday,2
h_-JFUci0BM,Eminem - Love The Way You Lie ft Skylar Grey on Radio 1,BBC Radio 1,299632,12692,202,576,Music,2017,December,12,Friday,11
6xe64i_4GhM,Controversial WH adviser speaks out on resignation,ABC News,296207,1225,1391,1816,News & Politics,2017,December,12,Thursday,16
4bWmB3cscBs,How Nike Designs for an N.B.A. Athlete | In the Studio,The New York Times,23222,778,29,41,News & Politics,2017,December,12,Saturday,23
oD9XpUKD7y4,ARCADE Game On Your Watch? | 10 Strange Amazon Products,Matthias,983147,23112,962,5755,Science & Technology,2017,December,12,Wednesday,22
dR10LRByhRc,99 CENT HOLIDAY SHOPPING ADVENTURE!,Amber Scholl,287677,14261,536,1028,Howto & Style,2017,December,12,Friday,2
89OP78l9oF0,Annihilation (2018) - Official Trailer - Paramount Pictures,Paramount Pictures,5376583,32001,3025,5050,Film & Animation,2017,December,12,Wednesday,14
tymvJ8wowG4,BROOKS GUESSES MAKEUP PRICES // Grace Helbig,Grace Helbig,152598,7530,113,481,People & Blogs,2017,December,12,Thursday,23
NsUQU3r2nsM,Ayrton Little Was ACCEPTED INTO HARVARD UNIVERSITY AT 16 YEARS OLD!,ChangeofplanZ,515428,5514,529,1741,Entertainment,2017,December,12,Wednesday,18
37z3bfXu3BA,Portugal. The Man - Cheer Up (from Bright: The Album) [Official Audio],Portugal. The Man,160892,2583,147,200,Music,2017,December,12,Friday,5
adz_lnvL0qI,Tamar's Executive Decision | Tamar & Vince | WE tv,WE tv,36064,272,46,95,Entertainment,2017,December,12,Thursday,22
vI4LHl4yFuo,Google - Year In Search 2017,Google,3257990,94373,6600,8866,Science & Technology,2017,December,12,Wednesday,7
XkVwqEdYlNA,The Last Jedi Cast Touches Bearded Dragons & Other Weird Stuff | Fear Box | Vanity Fair,Vanity Fair,1324411,46874,622,2422,Entertainment,2017,December,12,Wednesday,17
QzQpsHScgHs,Dark Colors Room Makeover | Mr. Kate,Mr. Kate,271779,14215,148,665,Howto & Style,2017,December,12,Thursday,21
h1bXpNJ5zK0,Ancient Weapons: Shuriken AKA Ninja Stars,The Nocturnal Alchemist,1879,32,2,38,Howto & Style,2017,December,12,Wednesday,14
arv7U6cfD40,the life-changing magic of tidying up,Anna Akana,212075,12760,167,507,Comedy,2017,December,12,Thursday,17
oQxKEtoHygY,DJ Earworm Mashup - United State of Pop 2017 (How We Do It),Dj Earworm,621513,19267,2205,2687,Music,2017,December,12,Wednesday,17
jehMXPadHS0,Star Wars: The Last Jedi Cast Play WOULD YOU RATHER? | MTV Movies,MTV International,464076,10358,213,865,Entertainment,2017,December,12,Wednesday,16
bAHAwesTLB4,THE MIRACLE SEASON | Official Trailer,LD Entertainment,890843,445,44,44,People & Blogs,2017,December,12,Thursday,15
jVbuBGSfLC4,How to Make a Workbench Episode 3 | Paul Sellers,Paul Sellers,35038,1406,11,88,Film & Animation,2017,December,12,Friday,10
6kLYXbNZWRs,Meet Teen Vogue's 2017 21 Under 21 | Teen Vogue,Teen Vogue,16948,1248,17,46,Nonprofits & Activism,2017,December,12,Friday,17
IGhC2EwCAWM,TESTING KYLIE $360 BRUSH SET VS MORPHE DUPES,James Charles,1648675,62011,2072,11881,Entertainment,2017,December,12,Wednesday,21
Na7VFFnqWVI,Lindsey Stirling - Angels We Have Heard on High,Lindsey Stirling,915783,49491,734,2474,Music,2017,December,12,Wednesday,18
ZLFak6N04GY,NEW: RECKLESS LOVE (ACOUSTIC VERSION) - Cory Asbury,Bethel Music,280506,8693,171,352,Music,2017,December,12,Wednesday,16
3_keXD1yV3E,EVENING SKINCARE ROUTINE WITH ESTÉE! | Vlogmas Day 13,Amelia Liana,65277,1967,61,152,Howto & Style,2017,December,12,Thursday,17
cZxOvNxbi7U,Annie Leibovitz Teaches Photography | Official Trailer,MasterClass,2563098,1570,16,73,Education,2017,December,12,Thursday,14
NP9HAYTK1cU,Chili Klaus + Herning Boys Choir 🔥 wait for it!,Chili Klaus,960177,8660,586,532,Comedy,2017,December,12,Wednesday,9
6FbdqwlR0H4,Poppy - Bleach Blonde Baby (Official Video),Poppy,971657,51428,4491,7819,Entertainment,2017,December,12,Wednesday,14
OGdfc7MA_qY,L.A. Vlog • Thrifting with Damon and Jo!,LaMadelynn,26800,1932,15,99,Howto & Style,2017,December,12,Thursday,20
KjHan6D3O3g,Sam Smith - Have Yourself A Merry Little Christmas in the Live Lounge,BBCRadio1VEVO,279571,5379,339,255,Music,2017,December,12,Wednesday,18
TOdGYZ20oSc,I made him fabulous! | Best Friend Makeover Challenge with boyinaband,Glam&Gore,514711,38431,509,3362,Entertainment,2017,December,12,Wednesday,23
EIer2-KAn7o,Atari Lynx | LCD Upgrade (Mcwill Mod),RetroManCave,12461,1614,6,215,Science & Technology,2017,December,12,Friday,14
fOhB5JyEkOQ,Star Wars Cast Takes Which Star Wars Character Are You? Quiz,BuzzFeed Celeb,1974031,50261,2481,3263,Entertainment,2017,December,12,Tuesday,18
IjFxx9SrOTU,Welcome to Winter PUNderland,Kyle Gunderson,89923,1097,43,59,Entertainment,2017,December,12,Tuesday,17
hZJDAJDD-uw,T-Mobile CEO John Legere | We're bringing the Un-carrier to TV,T-Mobile,142548,5178,336,897,Entertainment,2017,December,12,Wednesday,14
eZFvbili87g,The Greatest Showman | Rewrite The Stars ft. Zendaya | 20th Century FOX,20th Century Fox,224115,8504,49,231,Film & Animation,2017,December,12,Thursday,22
dedaP9ym-hY,Chris Brown - On Purpose (Audio) ft. AGNEZ MO,ChrisBrownVEVO,2042378,56388,1447,6611,Music,2017,December,12,Wednesday,5
XXXqaYls50o,Riverdale | Chapter Twenty-Three: The Blackboard Jungle Trailer | The CW,The CW Television Network,112385,1497,10,212,Entertainment,2017,December,12,Thursday,6
YfOHh5mt9SM,i have a condition that makes me feel like i'm dreaming all the time,doddlevloggle,461540,46206,571,4678,Entertainment,2017,December,12,Thursday,0
rf3iHqE240I,Where babies in movies come from,Vox,512885,17500,356,984,News & Politics,2017,December,12,Wednesday,12
N-3NfWJHNhg,Seth MacFarlane Doubts Aliens Have Visited Earth,Late Night with Seth Meyers,230733,2682,214,350,Comedy,2017,December,12,Wednesday,11
DKMC6HViGTM,Grace and Frankie - Season 4 | Official Trailer [HD] | Netflix,Netflix,57516,1471,49,112,Entertainment,2017,December,12,Wednesday,15
-2b4qSoMnKE,Ex-UFO program chief: We may not be alone,CNN,291653,3788,603,3093,News & Politics,2017,December,12,Tuesday,20
q-jZm-FUbqs,"Stephanie McMahon announces the first-ever Women's Royal Rumble Match: Raw, Dec. 18, 2017",WWE,1354133,25721,1772,5663,Sports,2017,December,12,Tuesday,4
fupYIggOq38,Mortal Engines Official Teaser Trailer [HD],Universal Pictures,2186681,22244,1158,3987,Entertainment,2017,December,12,Monday,16
lcvOVZ_ILrs,"High-speed Amtrak train derails in DuPont, Washington",Fox News,377906,1956,796,1001,News & Politics,2017,December,12,Monday,17
2pVHOaT9CZ4,Sesame Street Puppeteers Explain How They Control Their Puppets | WIRED,WIRED,199604,6824,89,494,Entertainment,2017,December,12,Monday,20
0-M5C7sQdGI,Kobe Bryant Jersey Retirement Press Conference,NBA,185891,5248,111,411,Sports,2017,December,12,Tuesday,3
8rQT3PWQoNI,Chaka Khan’s Diva Makeup Ritual | Beauty Secrets | Vogue,Vogue,41523,1988,70,176,Howto & Style,2017,December,12,Tuesday,14
FYaxa4r-fRw,NYC Subway Dogs Brighten People's Days | The Dodo,The Dodo,190140,5444,99,356,Pets & Animals,2017,December,12,Monday,14
yI7qQ85DTZY,Ralphie To The Rescue Performance | A CHRISTMAS STORY LIVE,FOX,11730,102,49,37,Entertainment,2017,December,12,Monday,4
whNT1a3igGo,Why Calzones Deserve More Love | Food Skills,First We Feast,282950,7654,98,524,Howto & Style,2017,December,12,Monday,20
cqHZTqr8u-s,GoPro: Lobster Waterfall with Rafa Ortiz,GoPro,45548,1776,159,83,Sports,2017,December,12,Tuesday,17
GMNkrW7jlQM,Weekend Update on Doug Jones Defeating Roy Moore - SNL,Saturday Night Live,1321434,13060,393,782,Entertainment,2017,December,12,Sunday,7
tBnIH8xPyZA,"What $2,500 Will Get You In NYC | Sweet Digs Home Tour | Refinery29",Refinery29,165560,2428,336,556,Howto & Style,2017,December,12,Sunday,16
m3b7A5JLO7I,"Christian Bale, Rosamund Pike & Wes Studi Speak On Hostiles",BUILD Series,8697,78,11,22,Entertainment,2017,December,12,Monday,22
bUijOzaPfr8,Donating Lots of Toys!,iJustine,161060,8392,428,1058,People & Blogs,2017,December,12,Saturday,22
2fJIRQJ39eA,"Chris Brown , Cardi B , Lil Kim , Remy Ma , Yo Gotti Live Hot 97 Hot For The Holidays Concert 2017",Zach Simmons,72739,804,191,273,Entertainment,2017,December,12,Friday,17
t0N7Vv7bafU,Kid Hilariously Steals Baby Jesus From Manger During Live Nativity Scene,Inside Edition,255517,3560,268,435,News & Politics,2017,December,12,Thursday,22
hu_4yAZVNsU,Kevin Hart Lives His Truth And Opens Up About Being Irresponsible And More,Breakfast Club Power 105.1 FM,2028315,28627,3519,10886,Entertainment,2017,December,12,Thursday,13
prmQgSpV3fA,BLACK THOUGHT FREESTYLES ON FLEX | #FREESTYLE087,HOT 97,1695280,66687,605,11415,Music,2017,December,12,Thursday,16
fmiZUgA-2W4,7 Amazing DIY Christmas Decorations Made From Pasta,Crafty Panda,8795,23,1,1,People & Blogs,2017,December,12,Friday,15
nRLP9BoSQo4,Dance in New York City: The New Vogueing Scene,The New York Times,7260,205,14,23,News & Politics,2017,December,12,Sunday,15
wzKL-bQKcgA,Anitta & J Balvin - Downtown (Official Lyric Video) ft. Lele Pons & Juanpa Zurita,Lele Pons,17758014,865679,25934,45223,Comedy,2017,December,12,Thursday,18
uJNKApY1Gys,the CASEY NEISTAT shoutout,Sara Dietschy,72522,3550,180,446,Film & Animation,2017,December,12,Saturday,4
CHXD9k19q1Y,dodie - In The Middle,dodieVEVO,539715,69563,894,5904,Music,2017,December,12,Friday,18
IfkWuQY0ti8,Goodwill Norwalk Store-The Spirit of Giving,Goodwillsandusky,296518,1974,41,157,Film & Animation,2017,December,12,Tuesday,20
dRvKm__GrqU,EVERY DAY Official Trailer (2018),Orion Pictures,2210090,6435,847,1214,Film & Animation,2017,December,12,Thursday,20
h_67XloYXTc,Will Smith Watched His Sons Jump Out of an Airplane,TheEllenShow,2303558,35609,1109,1299,Entertainment,2017,December,12,Thursday,14
