video_id,title,channel_title,views,likes,dislikes,comment_count,category_name,year,month,month_num,day,hour
qpAo_XvCQaQ,We have the EXCLUSIVE Super Troopers 2 trailer drop here and MEOW!,theCHIVE,1258994,15235,1023,1617,Entertainment,2018,January,1,Thursday,22
yLdav-8af6g,Master & Apprentice: Star Wars - Custom Lightsabers | Rooster Teeth,Rooster Teeth,240314,13652,158,681,Film & Animation,2018,January,1,Friday,21
GKBI_bVFSfs,Sturm Friederike - Grandiose Pilotenleistung am Airport Düsseldorf bei bis zu 110 km/h Seitenwind,HvdH-Plane-Spotter,5179255,28582,1196,2559,Autos & Vehicles,2018,January,1,Thursday,21
_Ihg1_3-0os,Remy Ma - Melanin Magic (Pretty Brown) (Audio) ft. Chris Brown,RemyMaVEVO,485881,19670,1659,4259,Music,2018,January,1,Friday,5
Kpxn9nl02qg,Melania Trump Sings 'Part of Your World' (Little Mermaid Parody),The Late Late Show with James Corden,425995,11520,1097,595,Entertainment,2018,January,1,Friday,6
MjSZs_uOWxg,Peter and His Heckler - Don't Stop Believin' (with Will Ferrell),The Tonight Show Starring Jimmy Fallon,458494,13227,484,777,Comedy,2018,January,1,Friday,10
8gcUmiOlM1M,Seven Seconds | Official Trailer [HD] | Netflix,Netflix,360896,4444,367,772,Entertainment,2018,January,1,Wednesday,15
nrB7aqfRzyE,Eagles Fan Gets Wrecked by Pole,494ta,637942,793,38,137,Film & Animation,2018,January,1,Monday,7
TYFAkFxeukE,"Democrats, Republicans reach deal to reopen federal government | ABC News Special Report",ABC News,36168,463,165,748,News & Politics,2018,January,1,Monday,18
2fxqFJsvus4,"Keeping Up With the Kardashians Katch-Up S14, EP.15 | E!",E! Entertainment,642382,3470,467,310,Entertainment,2018,January,1,Monday,2
DnSO5Uhobvo,Troye Sivan - The Good Side (Live on SNL),TroyeSivanVEVO,639685,59842,621,3861,Music,2018,January,1,Sunday,8
WAwRrtH-4Lg,My Horibal Speling,TheOdd1sOut,7797284,386330,4899,80500,Comedy,2018,January,1,Saturday,17
1e5vRpODASk,Small Stepper Robot Arm Shuffling Sugar Cubes,Electron Dust,4743,11,1,6,Science & Technology,2018,January,1,Saturday,4
Isvqg90LhqM,Lucas the Spider - Captured,Lucas the Spider,5605621,214818,4057,14381,Film & Animation,2018,January,1,Saturday,7
OO5_E0_NAOg,Scarlett Johansson Women's March Event Full Speech 2018 James Franco Natalie Portman,Sound Bites,60731,422,2030,949,Entertainment,2018,January,1,Sunday,15
V59YAu9l-gY,Andrew Wiggins Dunks on Poeltl Twice! Lowry 40 Points! 2017-18 Season,Chris Smoove,339187,8797,223,625,Sports,2018,January,1,Sunday,7
Cd2Ue_xw1oo,John Varvatos Spring/Summer 2018 Campaign Featuring Nick Jonas #JVxNJ,John Varvatos,4233,126,1,8,Entertainment,2018,January,1,Monday,2
MEEj62ZqFYo,END OF ZE WORLD ...PROBABLY FOR REAL THIS TIME,End of Ze World,323471,6081,1425,1070,People & Blogs,2018,January,1,Saturday,22
I92OeEHWmTc,Ed Sheeran Engaged to Childhood Friend Cherry Seaborn!,Entertainment Tonight,217531,2279,213,427,Music,2018,January,1,Saturday,23
vBdxi7-_HKw,Sergei Eisenstein the Father of Montage,Ryan Davidson,139026,427,93,51,People & Blogs,2013,May,5,Monday,15
IiRmtBZu0pM,COMING OUT TO MY LESBIAN MOMS,Andrew Lowe,835472,40769,9065,8300,Comedy,2018,January,1,Sunday,0
K9kVsnTQh-g,washing dishes by hand is better than using a dishwasher,paul wheaton,73902,261,55,96,Science & Technology,2010,May,5,Tuesday,1
k9XvXBqhu-E,How To Burn Fat in Your Lunch Break in 5 Minutes |  Tom Daley,Tom Daley,36591,2519,25,155,Sports,2018,January,1,Sunday,18
No35-c4zXjo,Are You a Millennial?,CollegeHumor,1629599,43060,3716,5722,Comedy,2018,January,1,Saturday,17
bqIVwa9VFDM,What Happens When You Get Electrocuted?,SciShow,335365,12576,234,818,Education,2018,January,1,Saturday,22
oDYoV8-9v10,That Time a Guy Parachuted Onto Devils Tower and No One Could Figure Out How to Get Him Down,Today I Found Out,1270778,30068,1237,2351,Education,2018,January,1,Saturday,16
A6owSHYjOiE,Beyond the Routine: Jordyn Wieber - The Trailer,FloSports,29305,75,12,12,Entertainment,2013,July,7,Monday,22
q260bjSiyq0,The Floppotron: Toto - Africa,Paweł Zadrożniak,344951,15728,145,1004,Music,2018,January,1,Saturday,19
FmE8DwZ6RHk,Crowd boos as Trump calls media 'fake' in Davos,CNN,792189,6006,19561,14848,News & Politics,2018,January,1,Friday,14
pylyPL64uxk,Team LeBron! Best Plays from Every All-Star on the Team | 2018 NBA All-Star Game,NBA,462906,4598,162,506,Sports,2018,January,1,Friday,2
nUgMn2ntSh4,Lucie Fink Trains Like A Professional Gymnast | Lucie For Hire | Refinery29,Refinery29,68965,1701,30,294,Howto & Style,2018,January,1,Friday,16
Prnw-NqXSEY,'Storm Chasers' Star Joel Taylor Dies at 38 Aboard Cruise Ship,Inside Edition,53635,1083,27,299,News & Politics,2018,January,1,Wednesday,23
Lj6Y6JCu-l4,"Zedd, Maren Morris, Grey - The Middle (Lyric Video)",ZEDDVEVO,2705268,120923,1843,4431,Music,2018,January,1,Tuesday,15
z7WjD5G5ZuY,"Revlon Live Boldly | Anthem with Ashley Graham, Adwoa Aboah, Imaan Hammam, Raquel Zimmerman | Revlon",revlon,7130,114,4,5,Howto & Style,2018,January,1,Wednesday,15
iuBPpEkUi8I,Bro's Night Out,Jason Yu,473593,13738,539,1101,People & Blogs,2018,January,1,Sunday,21
eHEwkvFFBII,Elise Mertens v Elina Svitolina match highlights (QF) | Australian Open 2018,Australian Open TV,109740,287,15,150,Sports,2018,January,1,Tuesday,5
_QufBstcsrc,Morgan Freeman - Receives Life Achievement  (SAG Awards 2018),MrTreknation,215775,2629,276,584,People & Blogs,2018,January,1,Monday,2
e89IWTGdIuQ,Staudt on Sports I 1-22-18,730 WVFN,9762,14,47,32,Sports,2018,January,1,Monday,17
aYnyMPc3LQ4,How to Make Life More Interesting,Jaiden Animations,3770744,220891,3665,50778,Film & Animation,2018,January,1,Sunday,18
ZWMp9BpWODk,Dragon Ball FighterZ Video Review,IGN,691970,13942,786,3007,Gaming,2018,January,1,Monday,14
dPuULksBPcI,Sean “Diddy” Combs On Janet Jackson And Justin Timberlake | WWHL,Watch What Happens Live with Andy Cohen,129466,656,258,250,Entertainment,2018,January,1,Monday,4
26qOMpjicGs,When you and your mates go snow boarding for the first time.,Funny New Videos,683434,5413,201,375,People & Blogs,2018,January,1,Monday,0
qDI8LnPq3VY,MTB Skills - Technical Climb,Geoff Mallinson,4880,2,4,1,Entertainment,2015,April,4,Thursday,12
NHrwcQQ38bA,Candide Thovex - quattro 2,Candide Thovex,1597365,43308,474,2068,Sports,2018,January,1,Monday,16
i0pmuBLUvmw,Going To Dinner With A Blind Girl In COMPLETE DARKNESS feat. Molly Burke,Drew Lynch,154731,8963,70,1063,Comedy,2018,January,1,Monday,14
yOZf7zIf6fM,Olivia Munn & Niecy Nash Hilariously Stole The Show At The 2018 SAG Awards | Access,Access,97710,422,573,190,Entertainment,2018,January,1,Monday,4
v3Nv2R9Acec,Quentin Tarantino’s Star Trek (Nerdist Presents),Nerdist,400911,11665,321,925,Entertainment,2018,January,1,Monday,16
PKP8Mimj3QI,Frances McDormand: Acceptance Speech | 24th Annual SAG Awards | TNT,TNT,108402,630,232,237,Entertainment,2018,January,1,Monday,3
mqf0f1h8ZTU,RUSH TV Fan Friday: Rush Hulk,Saskatchewan Rush,2078,4,0,0,Sports,2017,October,10,Friday,17
y6KYFcta4SE,"1 dead, others injured after Ky. school shooting",Newsy,559,9,0,4,News & Politics,2018,January,1,Tuesday,15
gvuvxLzUB-w,Amazon Go lets you skip the checkout line,USA TODAY,213764,2168,906,1101,News & Politics,2018,January,1,Sunday,15
d3h_uD-5d7A,Best of Beauty 2017 | Zoella,Zoella,992396,54016,1648,494,Howto & Style,2018,January,1,Monday,16
mA4NVRV1FGU,"Plastic Surgery, Transgender History & MORE with Amanda Lepore | Gigi",Gigi Gorgeous,216179,8130,526,769,Howto & Style,2018,January,1,Monday,10
gTF8KYoJkMM,Canada's Most Successful King,Tom Scott,227384,11494,822,804,Education,2018,January,1,Monday,16
ZJkc_C5-Cd8,What Even Matters Anymore - SNL,Saturday Night Live,3447677,35791,10773,7688,Entertainment,2018,January,1,Sunday,6
A4cASDml7Vk,Symon -Lonely Girl (Lyric Video),Symon,60794,317,14,34,Music,2018,January,1,Monday,14
z91xQ5u-_wY,ROCKET JUMP RC CAR - Worlds highest vertical jump with an RC car! (probably),David Windestal,47299,1128,40,238,Science & Technology,2018,January,1,Monday,21
_0uV-jMbHQU,5 Things You Missed at the 2018 SAG Awards | E! News,E! News,9595,46,92,26,Entertainment,2018,January,1,Monday,13
WlN04DM8ol0,ATV attempt to pull out the car ││ Any Rubbish,Any rubbish,4744,2,0,1,Entertainment,2018,January,1,Monday,10
EQzWr52gCWA,3D Printed Desk with Fusion 360,Desktop Makes,3735,139,1,42,Science & Technology,2018,January,1,Friday,15
Y-iFgDK_D5s,The Smallest Bird you have ever seen,A Chick Called Albert,4253449,146588,2443,14883,Pets & Animals,2018,January,1,Sunday,0
AmZJwThOfzE,This fox being a derp...,Dean Anderson,7325,6,6,1,Pets & Animals,2017,December,12,Saturday,19
6vbFe6F48Uo,iPhone X – Selfies on iPhone X – Apple,Apple,498874,10685,2177,0,Science & Technology,2018,January,1,Sunday,18
iLZSB-5Dyf8,READY PLAYER ONE - See The Future,Warner Bros. Pictures,688577,14143,490,1827,Entertainment,2018,January,1,Sunday,21
xPsEiZAOb_I,GIVING AWAY MY YOUTUBE ADSENSE,Caspar,296755,41687,403,2897,Entertainment,2018,January,1,Monday,17
PUcS24GuAog,BABY | The Weekly #3 | LIFESTYLE,Sprinkleofglitter,1143472,52424,564,4696,Howto & Style,2018,January,1,Sunday,9
XIxZLrruFpg,DIY JAPANESE FLUFFY PANCAKES,HellthyJunkFood,380261,12021,874,2161,Entertainment,2018,January,1,Sunday,14
7YibRBd46oo,James Corden Leads 'Subway Karaoke' During The 2018 GRAMMY Awards,The Late Late Show with James Corden,27666,1606,131,146,Entertainment,2018,January,1,Monday,2
pzPtlmzwajA,Jay-Z opens up about fighting for his marriage with Beyonce,CNN,402244,5140,2998,4175,News & Politics,2018,January,1,Sunday,13
woDDGmpV2KE,Who's Performing at the 2018 GRAMMYs?,Recording Academy / GRAMMYs,60857,932,145,695,Music,2018,January,1,Saturday,2
Vfugwq2uoa0,The Ritual | Official Trailer [HD] | Netflix,Netflix,433149,6626,215,938,Entertainment,2018,January,1,Friday,18
x25k_-Katf4,Ugly history: The 1937 Haitian Massacre - Edward Paulino,TED-Ed,223023,8592,523,1328,Education,2018,January,1,Thursday,15
jyNFL5t2A-U,Watch Courtroom Erupt In Applause After Larry Nassar Sentencing | MSNBC,MSNBC,250056,2429,281,923,News & Politics,2018,January,1,Wednesday,19
u2HVB-9lC3U,Hospital fire in South Korea kills at least 41 people,Guardian News,5870,11,0,5,News & Politics,2018,January,1,Friday,5
AKstzozuLKY,Christina Aguilera Watches Erika Jayne Crush “Fighter” | Lip Sync Battle,Lip Sync Battle,265260,1942,112,52,Entertainment,2018,January,1,Wednesday,15
Xx1tK0RyZxs,James Corden Almost Named His Daughter Beyoncé,LIVEKellyandRyan,72549,477,12,7,Entertainment,2018,January,1,Wednesday,20
Cs2Xr2b7ako,"STUDIO TOUR 2018! (Makeup collection, camera equipment & more)✨💛🌼",AdelaineMorin,242776,14631,149,1158,Howto & Style,2018,January,1,Wednesday,3
fSutgzDY_I4,The Cured - Official Trailer I HD I IFC Films,IFC Films,196755,807,29,74,Film & Animation,2018,January,1,Thursday,1
shiTAXD78Y8,Megyn Kelly Escalates Feud With Jane Fonda | The View,The View,639265,3197,2651,2476,News & Politics,2018,January,1,Tuesday,16
uikOKrrwsfw,This is One of the Smallest Restaurants in New York,Great Big Story,592142,18847,184,1258,People & Blogs,2018,January,1,Wednesday,7
N7xjGJwuu6E,"James Corden on hosting Grammys, Carpool Karaoke",CBS This Morning,37095,240,9,33,News & Politics,2018,January,1,Wednesday,14
K0u_kAWLJOA,God of War – Story Trailer | PS4,PlayStation,2568366,95646,1381,10809,Gaming,2018,January,1,Tuesday,16
NOciiz9WK5Y,The Making of Kendrick Lamar's LOVE. With Teddy Walton | Deconstructed,Genius,390695,18203,137,1264,Music,2018,January,1,Tuesday,17
e2ExvdtmIyU,The Breakfast Club Addresses Backlash After Amara La Negra Interview,Breakfast Club Power 105.1 FM,404417,2749,5874,5180,Entertainment,2018,January,1,Tuesday,13
hcfMZ6qjdXM,This Robot Can Walk and Swim — Inside You | ScienceTake,The New York Times,12168,381,12,47,News & Politics,2018,January,1,Thursday,0
90CCjgX0n20,OUR FAMILY. #MYCALVINS: Kardashian / Jenner,Calvin Klein,13124176,22664,17917,1990,Entertainment,2018,January,1,Monday,13
KpL6X856Y2E,Tsunami alerts across Pacific Coast following earthquake,Washington Post,269181,1012,190,432,News & Politics,2018,January,1,Tuesday,11
mWaY32HWjKE,QB Luke Falk: Need to show you're a fearless player,Cleveland Browns,1252,11,1,4,Sports,2018,January,1,Wednesday,18
lk8lozFBXpo,EVERY GAME STORE EVER,Smosh,1996355,62409,2733,4021,Comedy,2018,January,1,Monday,17
IvAvHjYoLUU,Why Cities Exist,Wendover Productions,521943,23689,971,2766,Education,2018,January,1,Tuesday,15
tblXEAKO6KA,Tony Rizzo Embarrassed by Dan Le Batard and Joe Thomas - Again,The Scam On Demand,1808,16,3,11,Music,2018,January,1,Wednesday,20
wrpeEitIEpA,Last Week Tonight: Season 5 Official Trailer (HBO),LastWeekTonight,1915926,62005,3224,4284,Film & Animation,2018,January,1,Monday,17
vCWrArYJntc,Kip Moore - Last Shot,KipMooreVEVO,189814,3241,225,141,Music,2018,January,1,Tuesday,4
lzEctvL0vrg,The Jet Li Maneuver: Beretta Disassembly at Gunpoint,Forgotten Weapons,244518,12488,95,1190,Education,2018,January,1,Tuesday,14
bqPARIKHbN8,How to Become TripAdvisor’s #1 Fake Restaurant,VICE,838711,28478,502,1471,Entertainment,2018,January,1,Monday,17
O6K0ZPRqzFU,M&M’s Super Bowl Teaser 2018 (featuring Danny DeVito) :15,mmschocolate,488695,9240,316,919,Entertainment,2018,January,1,Tuesday,0
FB64ez0kf1c,Megyn Kelly: I Have No Regrets About My Question To Jane Fonda | Megyn Kelly TODAY,TODAY,543596,2488,2895,1836,News & Politics,2018,January,1,Monday,15
phCIKfJY7SU,"The Undertaker returns: Raw 25, Jan. 22, 2018",WWE,2739574,48259,1668,4927,Sports,2018,January,1,Tuesday,3
X41ArlJVNYc,How to be a Hufflepuff,Sailor J,281875,24632,558,2517,Comedy,2018,January,1,Monday,22
6A3cHzFQsqI,The Fall - Kurious Oranj,ombremor,127623,694,7,104,Music,2012,December,12,Tuesday,14
dhOMtP72o2Y,"360°, Eruption of Volcano Klyuchevskaya Sopka, Kamchatka, Russia. 4K aerial video",AirPano,55599,268,38,25,Travel & Events,2018,January,1,Monday,13
dAyg7C2-mjQ,usa gymnastics + larry nassar | i am disgusted.,Shawn Johnson East,495854,13027,399,1038,People & Blogs,2018,January,1,Tuesday,1
dQMZLXaa1L8,Artwork Forge,Palo Alto Online,745,1,0,0,Sports,2018,January,1,Wednesday,23
JrFiNSueT3Y,10 BEST Moments From 2018 SAG Awards,Clevver News,414562,2607,746,407,Entertainment,2018,January,1,Monday,6
xYb9HeucPf0,Steve Brown Says Attacker Was Laughing Before He Stormed Stage | TMZ,TMZ,36982,213,17,100,Entertainment,2018,January,1,Tuesday,1
J41qe-TM1DY,JONGHYUN 종현 '빛이 나 (Shinin’)' MV,SMTOWN,7200045,1021328,2716,117897,Music,2018,January,1,Tuesday,4
a3Z3HAdHFdo,DJI Live - Adventure Unfolds,DJI,90365,0,0,0,Film & Animation,2018,January,1,Tuesday,16
rWHrWuDnReM,I'm Poppy - Trailer,Poppy,682990,35880,2609,5376,Entertainment,2018,January,1,Monday,15
kfPNxNIDHrA,It's not you. Commuting is bad for your health.,Vox,1030347,25002,2568,4254,News & Politics,2018,January,1,Monday,13
klGP5rtA76c,Missouri Star Quilt Company Live Stream,Missouri Star Quilt Company,41096,975,111,261,Education,2018,January,1,Tuesday,17
1zO2JEV6He0,When Your Friend Gets Dumped,IISuperwomanII,1421293,115308,942,8508,Comedy,2018,January,1,Tuesday,0
au5hwGS4KRE,Eagles players mock Vikings in blowout,NJ.com,1551300,4893,5016,3139,News & Politics,2018,January,1,Monday,2
wtegEB9lvaA,The Aces - Fake Nice,Red Bull Records,6882,291,22,21,Music,2018,January,1,Wednesday,21
5g20u8EfMdg,What If You Never Ate Fruits And Vegetables?,Life Noggin,616440,19998,483,5534,Education,2018,January,1,Monday,14
oZm_N6aSU0E,Entire Breaking Bad Series in 1 Minute,Esther Bellido,707170,9867,277,183,Entertainment,2018,January,1,Saturday,20
IzQwbRdh5Ts,High Fidelity Mixtape Rules,marjolijn2,31505,191,1,4,Science & Technology,2015,March,3,Sunday,18
YNpCXG66_PA,We Share Our Home With 14 Bears | BEAST BUDDIES,Barcroft Animals,47862,1064,26,108,Pets & Animals,2018,January,1,Tuesday,0
0cZLo3AAan4,"DJ Khaled, Rihanna - Wild Thoughts (2018 Live Performance)",Super Netvid,3014847,42556,2791,0,Music,2018,January,1,Monday,3
ytsZFYMGl0w,childish gambino grammy awards performance 2018,Shyrynne,1035381,25233,598,2412,People & Blogs,2018,January,1,Monday,1
npojBTA-pcQ,Lady Gaga - Joanne/Million Reasons (LIVE From The 60th GRAMMYs ®),EntertainmentVevo,845262,29699,444,1829,Music,2018,January,1,Monday,1
mdyegeGkdL4,Kendrick lamar / U2 / Dave Chappelle  - XXX / DNA Grammy 2018 Performance,SaggyJ,853242,13993,2891,6115,Entertainment,2018,January,1,Monday,0
q-giH_ezRTE,Kendrick Lamar and Rihanna win Best Rap/Sung Performance at The Grammy Awards 2018,RihannaNavyVevo,10754,163,30,50,People & Blogs,2018,January,1,Monday,21
fAWQ7qPsS3Y,Chelsea Handler Took a Break from News and Twitter to Campaign for Women in Politics,The Tonight Show Starring Jimmy Fallon,227226,3053,1858,1274,Comedy,2018,January,1,Saturday,11
bLKd4XXUWUo,Skittles ))) Possible Super Bowl Ad – Floating,SKITTLESbrand,76450,343,11,33,Entertainment,2018,January,1,Wednesday,15
sgX_StgXGF0,Marvel Studios' Black Panther - Kinetic Energy Film Clip,Marvel Entertainment,857897,24021,483,2760,Entertainment,2018,January,1,Wednesday,17
leHtDz4Mj0M,China BANS Hip Hop From Television,fantano,93591,3154,90,1353,Music,2018,January,1,Wednesday,18
eUgrVCDUCtE,A janitor's son is bullied by rich kids. So his dad stands up for him in the most heartwarming way.,Omeleto,2627504,46902,5537,12297,Film & Animation,2018,January,1,Tuesday,10
cOaRPJQXFG4,Sting & Shaggy - Don't Make Me Wait (audio),Interscope Records,235020,4249,127,236,Music,2018,January,1,Wednesday,16
cMtHByGJ8Ao,SCOTTY SIRE - MISTER GLASSMAN (Official Lyric Video),Scotty Sire,931571,133479,466,11359,Comedy,2018,January,1,Wednesday,1
_fVUX6-7VKE,"7.9 earthquake hits near Kodiak, AK",Fox News,1189824,6781,1218,3630,News & Politics,2018,January,1,Tuesday,11
rBUjOY12gJA,What Happens To Your Body When You Start Exercising Regularly,Tech Insider,226278,6918,68,166,Science & Technology,2018,January,1,Wednesday,17
Bx1aWLcUF3A,Ex-US gymnastics doctor sentenced for dozens of sexual assaults,ABC News,3068,20,5,10,News & Politics,2018,January,1,Thursday,10
5x-d3pabd5o,Jhené Aiko - Sativa ft. Rae Sremmurd,JheneAikoVEVO,3055492,109426,1729,4016,Music,2018,January,1,Tuesday,0
C1fRIyBW4kk,PJ Morton First Began 'Official Music Video',pjmorton,17342,768,4,74,Entertainment,2018,January,1,Wednesday,15
OGYASOBiU_E,Last Names,Domics,2326176,172597,1286,47828,Comedy,2018,January,1,Wednesday,2
lr4MmmWQtZM,Why is it so Easy to be Thin in Japan?,What I've Learned,277229,14012,194,1663,People & Blogs,2018,January,1,Tuesday,15
JZoO1Ftj-bM,Honest Trailers - Get Out,Screen Junkies,2091534,58896,2246,6315,Film & Animation,2018,January,1,Tuesday,18
P-MQBhBwvgM,"Elton John - His Past, London's Present. A Taste Of The Future.",Elton John,71075,602,211,59,Music,2018,January,1,Tuesday,23
VRJmcxCrAOA,Real Life Trick Shots 2 | Dude Perfect,Dude Perfect,29090799,1017919,15066,51282,Sports,2018,January,1,Monday,22
Q1CFfU2gXHw,Apple HomePod: Everything to know before you buy (Apple Byte),CNET,72607,1130,113,264,Shows,2018,January,1,Wednesday,20
Di4QJUCElgs,Answering Questions I've Avoided...,jessiepaege,160409,20169,80,2799,People & Blogs,2018,January,1,Wednesday,22
oGmIFXfgPM4,Jennifer Lopez & David Dobrik FEAR BOX Challenge | #JLoNOW,AT&T,790865,39472,231,760,Science & Technology,2018,January,1,Tuesday,23
uGwcNjWrgaU,Why Are Fat People a Joke?,LoeyLane,290138,0,0,330,Entertainment,2018,January,1,Tuesday,14
p5HH2UfZ2wE,DOG TRIES TO WAKE UP SLEEPING PIG,Newsflare,437271,6959,88,635,Pets & Animals,2018,January,1,Tuesday,17
SS0ebmCqHxs,Don Diablo - People Say ft. Paije | Official Music Video,DonDiablo,689313,38244,549,1680,Music,2018,January,1,Wednesday,20
DjbysQgJ64Y,"Hillary Clinton, Cardi B & More Audition for Fire & Fury - 2018 GRAMMYs",The Late Late Show with James Corden,2393894,46472,36669,20572,Entertainment,2018,January,1,Monday,3
l0VNEl2qw2M,Roger Federer press conference (F) | Australian Open 2018,Australian Open TV,296001,2177,74,927,Sports,2018,January,1,Sunday,17
KXBYn9cwl7U,Mamma Mia! Here We Go Again - Grammys Spot,Universal Pictures,1122381,5424,292,394,Entertainment,2018,January,1,Monday,1
_GcsQuOGPPk,I Dyed My Virgin Hair For The First Time | Beauty With Mi | Refinery29,Refinery29,97882,2420,78,280,Howto & Style,2018,January,1,Monday,16
7FceZB6qMiA,"Kyrie Irving and Stephen Curry Duel at Oracle | January 27, 2018",NBA,155006,2607,43,832,Sports,2018,January,1,Sunday,5
kD3XrTz8G8Q,Chloe Kim wins Women’s Snowboard SuperPipe gold | X Games Aspen 2018,X Games,14513,124,3,13,Sports,2018,January,1,Sunday,6
4Uhe7pNqCFo,Running Through Glass in Slow Motion,The Slow Mo Guys,2297105,73435,1314,3728,Entertainment,2018,January,1,Friday,17
YLPNjaAOrBw,Did Alexa Lose Her Voice? - Teaser - Amazon Super Bowl Commercial LII,amazon,9627575,1007,94,264,Entertainment,2018,January,1,Friday,21
H3mX88_tx3Q,Trump Goes to Davos While Congress Debates Immigration: A Closer Look,Late Night with Seth Meyers,1694595,15585,1928,2421,Comedy,2018,January,1,Friday,2
gNG0GiSrwas,"Momsplaining with Kristen Bell #KidsPartyGoals, Ep. 2",TheEllenShow,596467,10023,773,317,Entertainment,2018,January,1,Friday,14
I5qFoctplSU,Best Hands: 2018 Pro Bowl Skills Showdown | NFL Highlights,NFL,1691529,14149,434,1235,Sports,2018,January,1,Friday,2
q11UD-6XT-8,Stephen's Covetton House Meets Gwyneth Paltrow's Goop,The Late Show with Stephen Colbert,591650,6078,1666,1689,Entertainment,2018,January,1,Friday,8
gfmXCAwBkCE,Viola Davis on Melania Trump's Love of How to Get Away with Murder,Jimmy Kimmel Live,331981,4008,1182,902,Entertainment,2018,January,1,Friday,11
t8a8EFMAuSU,WWE's Vince McMahon announces he will relaunch XFL in 2020 [Press Conference] | ESPN,ESPN,708109,12092,1016,6669,Sports,2018,January,1,Thursday,20
de8K18_G0qk,Ferras - Coming Back Around,FerrasVEVO,16387,1227,12,159,Music,2018,January,1,Friday,17
OG2C2KgtRRU,How Zippers Are Made - Part 2 Adding Teeth to the Zipper Tape,UCAN Zippers USA,4734,11,3,2,Howto & Style,2015,July,7,Wednesday,23
HvPbH30KWLE,BTS Takes on L.A. | Vogue,Vogue,1319753,223647,850,11860,Music,2018,January,1,Thursday,14
jHvSF0njyvc,Judge Rosemarie Aquilina Full Remarks to Larry Nassar | NBC News,NBC News,123828,1891,57,447,News & Politics,2018,January,1,Thursday,1
XIZmIl9SsXk,People Try The New Diet Coke Flavors,BuzzFeedVideo,660467,10483,1221,1145,People & Blogs,2018,January,1,Thursday,2
zsbT6NMUrSk,Judge Aquilina Delivers Powerful Statement Before Sentencing Larry Nassar | TIME,TIME,155341,1263,99,571,News & Politics,2018,January,1,Wednesday,20
lRXHd3HNzEo,AM Radio Transmitter on ESP32,bitluni's lab,10891,771,5,79,Science & Technology,2018,January,1,Friday,16
Epm5_DSfMn4,The vision for XFL in 2020,XFL,26668,272,34,110,People & Blogs,2018,January,1,Thursday,20
f1xIeTCgoFk,BLACKPINK - INTRO +  ‘마지막처럼 (AS IF IT’S YOUR LAST)’ in 2018 Seoul Music Awards,BLACKPINK,3848009,166757,2079,13175,People & Blogs,2018,January,1,Thursday,11
RjujNLl1jyk,How-To: Make a Deadliest Catch Pineapple Bowl with Trap Kitchen,Munchies,112376,2788,158,247,Entertainment,2018,January,1,Thursday,12
Np0LMwqtOVM,Brad Makes Sous Vide Steak | Kitchen Basics | Bon Appetit,Bon Appétit,469539,9372,238,910,Howto & Style,2018,January,1,Wednesday,17
TMfStd3v330,How NOT to sexually harass someone - The Mash Report - BBC Two,BBC,161460,2266,440,480,Entertainment,2018,January,1,Wednesday,14
m0AZ5LKlGyk,Man drops magnum of Champagne on the floor in Ibiza's club,MN khan,1791693,1975,342,529,People & Blogs,2018,January,1,Wednesday,1
52L2HML5O1k,"The Last Jedi Novelization to Feature Deleted Scenes, Star Wars Day at Sea, and More!",Star Wars,319017,4994,357,936,Entertainment,2018,January,1,Wednesday,20
9flXyzcSfT4,R3HAB x Mike Williams - Lullaby (Official Video),R3HAB,548658,26021,143,1214,Music,2018,January,1,Friday,15
XT3gEidTKAc,Just a Couple Friends - Acoustic (MUSIC VIDEO),Sugar Pine 7,140815,12313,193,891,Entertainment,2018,January,1,Wednesday,21
9r6NI9m_IxM,Elton John - Farewell Yellow Brick Road Tour: The Launch (VR180),EltonJohnVEVO,864149,2772,414,138,Music,2018,January,1,Wednesday,21
3ChgRbqGi-E,Kygo - Stranger Things ft. OneRepublic,KygoOfficialVEVO,4188327,155328,2118,4647,Music,2018,January,1,Wednesday,8
4MYaA4WEo1Y,Undercover footage from inside secretive Presidents Club Charity Dinner,Business Insider UK,98683,187,615,332,News & Politics,2018,January,1,Wednesday,13
0GQmGOju6CE,THE GHOST IN MY HOUSE - Morgan Adams,Morgan Adams,952677,66539,771,11284,Entertainment,2018,January,1,Wednesday,18
Mhzmc7LRIGo,Opposite Twins Swap Lives for a Day!,Niki and Gabi,3343908,99337,2915,8278,Howto & Style,2018,January,1,Wednesday,14
8BAhwgjMvnM,Pacific Rim Uprising - Official Trailer 2 [HD],Legendary,7227939,72979,6069,12587,Film & Animation,2018,January,1,Wednesday,15
TynRELscK8s,When Your Bunny is a Diva,Bini the Bunny,26102,2246,10,199,Pets & Animals,2018,January,1,Thursday,19
NuXHriwQB9g,01/24/2018 - Falcon Heavy Test Fire Finally,Dennis Kapatos,208865,1542,62,190,Science & Technology,2018,January,1,Wednesday,17
kDiJh8loTOE,Falcon Heavy and 9 static fires - What you need to know!,Everyday Astronaut,207272,6802,110,603,Science & Technology,2018,January,1,Wednesday,21
wqS9QwOIH3s,Natural Defined Instagram Makeup | Jessica Clements,Jessica Clements,177613,9578,100,433,Howto & Style,2018,January,1,Wednesday,22
0ufNmUyf2co,Bike Check - My freak bikes,Seth's Bike Hacks,238483,7894,81,778,Howto & Style,2018,January,1,Thursday,0
gTRRvvE3HiU,Helping Shane Dawson Get His Attitude Back (RIVERDALE Skit) | Madelaine Petsch,Madelaine Petsch,507753,45824,341,2333,People & Blogs,2018,January,1,Wednesday,21
16a1LttU5qc,I carve a pencil from a pencil from a pencil  (pencil inception),Bobby Duke Arts,2368518,96698,2336,7689,Howto & Style,2018,January,1,Tuesday,22
Z00-9MhEw5o,Vegan Mystery Meat Taste Test w/ Christine Sydelko!,MyHarto,211469,10587,107,414,Comedy,2018,January,1,Wednesday,21
sNgByUWwFKU,Falcon Heavy Demo | Static Fire,SpaceX,520176,15243,70,1394,Science & Technology,2018,January,1,Wednesday,22
Wk6Z7HLpx8s,"Magnitude 8.2 earthquake strikes Alaska, tsunami watch issued for US West Coast",ABC Action News,1257486,7301,940,3459,News & Politics,2018,January,1,Tuesday,10
