video_id,title,channel_title,views,likes,dislikes,comment_count,category_name,year,month,month_num,day,hour
9wRQljFNDW8,Dion Lewis' 103-Yd Kick Return TD vs. Denver! | Can't-Miss Play | NFL Wk 10 Highlights,NFL,81377,655,25,177,Sports,2017,November,11,Monday,2
Om_zGhJLZ5U,TL;DW - Every DCEU Movie Before Justice League,Screen Junkies,288922,7515,792,2111,Film & Animation,2017,November,11,Sunday,18
goP4Z5wyOlM,Iraq-Iran earthquake: Deadly tremor hits border region - BBC News,BBC News,34785,308,26,413,News & Politics,2017,November,11,Sunday,21
8NHA23f7LvU,Jason Momoa Wows Hugh Grant With Some Dothraki | The Graham Norton Show,The Graham Norton Show,1496225,16116,236,605,Entertainment,2017,November,11,Friday,19
IE-xepGLVt8,Mayo Clinic's first face transplant patient meets donor’s family,Mayo Clinic,237307,1896,74,260,Science & Technology,2017,November,11,Friday,12
cOc3tsFWoRs,Jason Momoa & Lisa Bonet: Love at First Sight,The Late Late Show with James Corden,1497519,15504,353,1084,Entertainment,2017,November,11,Friday,9
wnwF1FHybDQ,Mark Wahlberg's Kids Use Him for His Celeb Connections,Late Night with Seth Meyers,225286,1731,193,206,Comedy,2017,November,11,Friday,11
pz95u3UVpaM,Camila Cabello - Havana (Vertical Video) ft. Young Thug,CamilaCabelloVEVO,5476737,286268,4083,12254,Music,2017,November,11,Friday,5
yuBqWcSKrCk,"Owen Wilson on Meeting Julia Roberts, and Tandem Biking",TheEllenShow,304926,3305,130,275,Entertainment,2017,November,11,Friday,14
dW4wpGg64pE,Meryl Streep Meets Anna Wintour at Vogue,Vogue,1017803,25122,628,1504,Entertainment,2017,November,11,Thursday,18
k29YnfttqEU,Mean Tweets – Country Music Edition #3,Jimmy Kimmel Live,1315873,9312,584,769,Comedy,2017,November,11,Thursday,4
htvR_dBs3eg,Sam Smith - The Thrill of It All ALBUM REVIEW,theneedledrop,98422,2926,106,798,Music,2017,November,11,Friday,21
5x1FAiIq_pQ,Alicia Keys - When You Were Gone,Alicia Keys,95944,1354,181,117,Music,2017,November,11,Thursday,15
vd4zwINEcLY,Live in the now!,poofables,95085,909,52,193,Entertainment,2011,March,3,Sunday,4
7fm7mll2qvg,Sigrid - Strangers (Lyric Video),SigridVEVO,91776,4604,46,357,Music,2017,November,11,Friday,0
q-WipZ9p0wk,Three meals that cost me $1.50 each,Brothers Green Eats,77630,1991,83,208,Howto & Style,2017,November,11,Thursday,14
zy0b9e40tK8,Dark | Official Trailer [HD] | Netflix,Netflix,378750,5642,146,675,Entertainment,2017,November,11,Thursday,9
rL4WkebTT_U,Where is TOKYO'S GREATEST View?,Abroad in Japan,151709,9210,71,1103,Entertainment,2017,November,11,Thursday,15
Y6eKxjMA9ek,"Dropping And CATCHING A Paper Airplane At 2,000 Feet!",Tucker Gott,175852,15909,200,852,Entertainment,2017,November,11,Thursday,16
Q6Usd3_fbq8,Improvising in the style of different classical composers | Practice Notes 34,Nahre Sol,5149,242,0,54,Music,2017,November,11,Friday,4
44NYFvhXmW8,Thirty Seconds To Mars - Walk On Water (Official Music Video),ThirtySecondsToMarsVEVO,1905487,65854,2442,4490,Music,2017,November,11,Wednesday,13
9wg3v-01yKQ,Harry Styles - Kiwi,HarryStylesVEVO,9632678,810895,16139,59473,Music,2017,November,11,Wednesday,13
F-j_6IuaYfw,I Miss the Old Taylor,Wong Fu Productions,476389,16106,950,2077,Entertainment,2017,November,11,Wednesday,21
afgvlR9WmIQ,Maroon 5 - What Lovers Do (Live On The Ellen DeGeneres Show/2017),Maroon5VEVO,762616,20159,336,899,Music,2017,November,11,Thursday,2
P4YJwy_T9pM,I Picked My Girlfriend's Outfit Blindfolded,Tyler Williams,691229,31892,197,1404,People & Blogs,2017,November,11,Thursday,3
YqH4eWR7jDQ,"The Oak Beams of New College, Oxford",Stewart Brand,6412,49,0,2,Education,2012,June,6,Sunday,19
B4gXsobd_ao,What Are Diminutives – and Why We Like Them,The School of Life,79306,3809,127,670,Education,2017,November,11,Thursday,14
x8eLIJAM58M,KUWTK | Scott Gets Upset Over Being Uninvited to Khloe K.'s Party | E!,E! Entertainment,812007,5894,951,851,Entertainment,2017,November,11,Wednesday,14
6V_aZsATDsM,"Chapter 28: I Love My Baby But, I Miss My Dad",Whitney Port,55398,1170,22,336,Howto & Style,2017,November,11,Thursday,17
qg0GdM60syI,Huffy Metaloid Bicycle Commercial 1997,90s Commercials,773,2,0,0,Education,2017,March,3,Friday,21
8j_BYfVEyhA,"O.T. Genasis Talks About His Come Up, Opens Up About His Son's Autism  + More",Breakfast Club Power 105.1 FM,581288,5075,725,1780,Entertainment,2017,November,11,Wednesday,13
9ymjcSvEyhk,Enter Shikari - The Sights (Official Video),Enter Shikari,99619,3959,158,335,Music,2017,November,11,Thursday,14
oB3SAI2oCqk,Caterham Chris Hoy 60 Second Donut Challenge,Caterham Cars,4850,22,1,1,Autos & Vehicles,2017,November,11,Thursday,9
HNa_UWX51_s,Last Friday Night - Katy Perry ('40s Jazz Vibes Style Cover) ft. Olivia Kuper Harris,PostmodernJukebox,226088,10844,302,555,Music,2017,November,11,Thursday,18
08nkwgZIE4I,P!nk - Barbies (Audio),PinkVEVO,651036,23338,442,1101,Music,2017,November,11,Wednesday,22
5Smb3tZD1Qc,Tamar Braxton Talks Divorce In First Interview,Tamar Chronicles,451356,3454,284,623,Entertainment,2017,November,11,Wednesday,18
YHDbsyyjld0,A Tropical Island with 500 CATS!,Kitten Lady,46571,4250,16,408,Pets & Animals,2017,November,11,Thursday,23
uyl6WtHEYOQ,Fire breathing full twist backflips in one minute - Guinness World Records Day,Guinness World Records,28539,681,25,45,Entertainment,2017,November,11,Friday,20
bhoFXkVy8JA,Basmati Blues - Trailer,Blockbuster,12609,40,79,17,Film & Animation,2017,October,10,Friday,8
_w58R1OGQFA,Train - Have Yourself a Merry Little Christmas,TrainVEVO,30021,569,42,44,Music,2017,November,11,Thursday,15
BEweWXa5Twk,FACE SURGERY WITH MAKEUP,Christen Dominique,471266,23634,460,1714,Howto & Style,2017,November,11,Thursday,3
egXr0PU-kCY,BEAUTY GURU GETS A MAKEOVER... FINALE,James Charles,1073134,47793,1886,5358,Entertainment,2017,November,11,Wednesday,22
fIQ2Ty2OL34,"James Harden Triple-Double 2017.11.09 vs Cavs - 35 Pts, 13 Asts, 11 Rebs, 5 Stls, 2 GOOD!",FreeDawkins,18573,420,10,236,Sports,2017,November,11,Friday,4
d_j512i2k6c,Could an Earthquake Destroy USA - Biggest Earthquakes Ever,The Infographics Show,250193,5748,332,1197,Education,2017,November,11,Wednesday,20
4d07RXYLsJE,Sphaera - demonstrating interaction,Jenny Hanell,1827,3,0,2,Science & Technology,2017,November,11,Saturday,20
DOIw62TXYkg,GoPro Gets Melted by Lava and Survives,PetaPixel,2457408,2707,200,209,Science & Technology,2017,November,11,Tuesday,19
0lbJHqAGpbA,Dog reunites with her family,RM Videos,51143,258,5,10,Comedy,2017,November,11,Thursday,16
JuP1Z8xpRb8,Brian Justin Crum - Wild Side,BrianJustinCrum,27010,1666,36,150,Entertainment,2017,November,11,Thursday,17
CR9zYgr84QY,Chocolate Orange Autumn Cupcakes | Cupcake Jemma,CupcakeJemma,122669,5723,55,263,Howto & Style,2017,November,11,Thursday,18
1640fZpYBSY,I love the Price is Right! Wooo! -Kevin,Anaki Abo,358597,1211,72,593,People & Blogs,2017,November,11,Tuesday,18
M2-IpsWQUWs,Katy Perry - Swish Swish (Behind the Scenes with Just Dance),Katy Perry,56012,6243,106,414,Entertainment,2017,November,11,Thursday,19
7m630xvAJtA,I'm With Her - See You Around [Official Audio],I'm With Her,6148,121,3,19,People & Blogs,2017,November,11,Thursday,16
510KQ_LXGww,My Every Day Autumn Makeup | Zoella,Zoella,1390440,86207,1775,710,Howto & Style,2017,November,11,Wednesday,18
CO9dIyNM_9Q,Pitcher Roy Halladay Dies After Crashing ICON A5 Plane He Promoted in October (File),Storyful News,244532,633,174,765,News & Politics,2017,November,11,Tuesday,22
hX643KbiI4s,Selena Gomez Singing Wolves and It Ain't Me FULL Instagram Live | Acoustic,Tu Fan,82087,998,93,289,Entertainment,2017,November,11,Wednesday,21
mwpHSMv1pI4,Girlfriend Gives Me A Surprise Makeover!? | Hannah Hart,MyHarto,359120,15130,223,1143,Comedy,2017,November,11,Thursday,1
Mfiim71QdYQ,Obama arrives for jury duty at Daley Center,Chicago Sun-Times,33768,426,88,550,News & Politics,2017,November,11,Wednesday,18
UFPSIa1cLRQ,Phillip Phillips - Magnetic (Audio),PhilPhillipsVEVO,38068,2195,28,154,Music,2017,November,11,Thursday,5
o78x918zbFk,TOTAL FAIL! NATASHA DENONA HOLIDAY WTF,Tati,1277364,56867,2148,25326,Howto & Style,2017,November,11,Wednesday,18
iNf6VErGDLI,Ozuna - Música Sin Fronteras (A YouTube Documentary),Ozuna,1498866,67227,1473,4645,Music,2017,November,11,Wednesday,14
6ixU_vdE0Es,BOYFRIEND DOES MY MAKEUP | Madelaine Petsch,Madelaine Petsch,280065,20289,38,939,People & Blogs,2017,November,11,Wednesday,22
wRGldR_SQAA,Apple Clips sample,Steve Kovach,2259,0,0,0,People & Blogs,2017,November,11,Thursday,18
agKDPntMv-E,Stephen A. Smith slams the Philadelphia 76ers for its 'Trust The Process' | First Take | ESPN,ESPN,470191,4037,430,1553,Sports,2017,November,11,Wednesday,15
Xl38SuxyrgM,"STEPH CURRY and OMRI CASSPI, postgame GSW (9-3) vs MIN: peaking?, turnovers, Casspi role",LetsGoWarriors,16305,147,13,47,Sports,2017,November,11,Thursday,7
u7pV4vxD1bs,World's first self-driving shuttle crashes on first day of use,KSNV News 3 Las Vegas,169511,57,59,79,News & Politics,2017,November,11,Wednesday,20
zYWt2mnalP8,How To Do Thanksgiving Makeup That Has Nothing To Do With The 566 Federally Recognized Tribes,Sailor J,160477,8388,691,950,Entertainment,2017,November,11,Wednesday,0
PoNWU2cox9w,Inside Keanu Reeves' Custom Motorcycle Shop | WIRED,WIRED,704363,16352,224,841,Autos & Vehicles,2017,November,11,Wednesday,15
6hTzM1BPdU8,Kids Describe America to Koji the Illustrator,HiHo Kids,130778,5684,53,737,People & Blogs,2017,November,11,Wednesday,21
MCW5HUkrr-o,Impossible Active Audio Noise Cancelling by Muzo,ElectroBOOM,560569,29990,341,1788,Science & Technology,2017,November,11,Wednesday,17
VsYmwBOYfW8,Mean Tweets – Jimmy Kimmel Edition,Jimmy Kimmel Live,2765121,35529,1705,2388,Comedy,2017,November,11,Tuesday,8
jr9QtXwC9vc,The Greatest Showman | Official Trailer 2 [HD] | 20th Century FOX,20th Century Fox,2671756,12699,505,1010,Film & Animation,2017,November,11,Monday,14
TSqwDQHE1J8,Carey Mulligan Doesn't Tell People She's an Actress,Late Night with Seth Meyers,137749,1145,61,131,Comedy,2017,November,11,Tuesday,10
Z3OZyb2iWqQ,Colin Farrell Dishes on Rendezvous with Girlfriend,TheEllenShow,137860,1950,64,136,Entertainment,2017,November,11,Tuesday,14
TUmyygCMMGA,Why the rise of the robots won’t mean the end of work,Vox,635985,20721,2417,4111,News & Politics,2017,November,11,Monday,13
0zk2SwmCpss,"Joel Embiid Full Highlights 2017.11.13 at Clippers - 32 Points, 16 Rebs, UNSTOPPABLE!",FreeDawkins,63780,831,12,301,Sports,2017,November,11,Tuesday,6
B5HORANmzHw,Founding An Inbreeding-Free Space Colony,SciShow,286577,9606,248,1196,Education,2017,November,11,Sunday,22
HBS9783c0BI,Jaden Smith: Watch Me,The Late Late Show with James Corden,102639,3218,1085,475,Entertainment,2017,November,11,Tuesday,6
sbcbvuitiTc,Stephon Marbury and Jimmer Fredette fight in China,NBA Highlights · YouTube,1015189,2133,2483,1465,Sports,2017,November,11,Friday,18
069D0NmW39o,"Wildest Superstar distractions: WWE Top 10, Nov. 11, 2017",WWE,1155622,16060,883,1018,Sports,2017,November,11,Saturday,15
kOnQocd799Y,Everything Wrong With Baby Driver In 14 Minutes Or Less,CinemaSins,2844271,60500,3667,8122,Film & Animation,2017,November,11,Thursday,17
wJYE0sFOteE,Inside the Cheese-Aging Caves 30 Feet Under Brooklyn | I Got a Guy | Bon Appétit,Bon Appétit,99019,2404,40,135,Howto & Style,2017,November,11,Friday,16
viyRD5z6ilQ,Luke Bryan - O Holy Night (Audio),LukeBryanVEVO,147193,5405,151,395,Music,2017,November,11,Friday,5
x9mh-SwSKas,Surprise After Surprise | October Vlog,clothesencounters,269509,10801,158,653,Howto & Style,2017,November,11,Friday,18
g5c1bk8weaQ,FIRST TIME IM DOING THIS! TALKS WITH LIZA.,Liza Koshy,3741812,314872,2647,12114,Comedy,2017,November,11,Friday,3
fCTKDn3Q8xQ,Idiot's Guide to Japanese Squat Toilets,Rachel and Jun,1185773,45513,1378,4794,People & Blogs,2017,November,11,Thursday,11
xg9ebVTL9yE,Empire Of The Sun - Way To Go,empireofthesunvevo,178313,9072,98,656,Music,2017,November,11,Friday,5
fbHbTBP_u7U,NF - Let You Down,NFVEVO,2185367,96850,1130,8216,Music,2017,November,11,Thursday,5
uiA4B5Y63IQ,THE SHAPE OF WATER - Final Trailer,FoxSearchlight,366814,4099,172,449,Film & Animation,2017,November,11,Thursday,22
QOksZ8VogRw,Bastille - World Gone Mad (from Bright: The Album) [Official Music Video],Atlantic Records,797436,29425,585,1497,Music,2017,November,11,Thursday,17
Ja_GMU7-sjs,Google Pixelbook: $1000 of Weird!,Marques Brownlee,1646057,53901,1566,5963,Science & Technology,2017,November,11,Thursday,21
9oFP-pOMNwE,H&M Holiday 2017 starring Nicki Minaj – official teaser,H&M,271685,3330,854,0,Entertainment,2017,November,11,Thursday,8
ttf_EzEkxBk,"Roy Halladay Plane Crash Video, Witnesses Say He Was Showboating | TMZ Sports",TMZSports,3505996,5934,3400,5162,Sports,2017,November,11,Wednesday,17
Eg_kW5fw6qU,Could Anastasia Become A Disney Princess?,SuperCarlinBrothers,194946,9278,137,2803,People & Blogs,2017,November,11,Thursday,23
_dhneCO4YEE,"Russian Bots and Trolls | November 8, 2017 Act 2 | Full Frontal on TBS",Full Frontal with Samantha Bee,392482,5659,2432,1311,People & Blogs,2017,November,11,Thursday,7
J_QGZspO4gg,Sia - Snowman,SiaVEVO,1882868,88072,1219,6083,Music,2017,November,11,Thursday,15
ozkqm2ifMw8,2CELLOS - Cinema Paradiso [OFFICIAL VIDEO],2CELLOS,226317,11702,125,471,Music,2017,November,11,Friday,13
RYs08kX3Ih4,SECRETS REVEALED! HOW I LAY MY LACE WIGS! | AALIYAHJAY,MsAaliyahJay,232083,14766,408,1107,Howto & Style,2017,November,11,Friday,1
PkRBTF6nt4E,Tesla's biggest problem is one nobody saw coming,Business Insider,144694,1012,588,288,News & Politics,2017,November,11,Friday,13
Rq9-mW6HgQE,Sean Astin Knew Nothing About 'Lord Of The Rings' Once Upon A Time,The Late Show with Stephen Colbert,908489,12261,339,1600,Entertainment,2017,November,11,Thursday,8
LMCuKltaY3M,Elbow - Golden Slumbers (John Lewis Advert 2017),ElbowVEVO,180606,2400,159,239,Music,2017,November,11,Friday,8
EYkEshCOhEU,The Ultimate Red Lip Look | Nicole Guerriero,Nicole Guerriero,308352,15765,399,984,People & Blogs,2017,November,11,Friday,0
6nJw-jPQYVI,A Day in The Life of David Letterman,Late Show with David Letterman,193832,1351,25,128,Entertainment,2015,May,5,Thursday,7
1Wk8ZRgXQnY,Andy Grammer - The Good Parts (Official Audio),Andy Grammer,41251,1561,29,96,Music,2017,November,11,Thursday,22
tOFkFZbPdnQ,Typical audience reaction to a bass solo...,Danny Sapko,524911,7822,185,403,Music,2017,November,11,Thursday,0
qEEtzzi1EII,Birthdays - Simon's Cat | GUIDE TO,Simon's Cat,467804,19962,268,953,Pets & Animals,2017,November,11,Thursday,13
RQDphL2MVlM,Everything I Wore This Week! Outfit Diary 1,Dina Tokio,77302,3756,123,222,Howto & Style,2017,November,11,Friday,22
cYw-oyJ7AEY,"Pitbull, Stereotypes - Jungle (Lyric Video) ft. E-40, Abraham Mateo",PitbullVEVO,304700,12347,577,756,Music,2017,November,11,Friday,8
8l_e6bx8UG8,Remy Ma - Wake Me Up (Audio) ft. Lil' Kim,RemyMaVEVO,1440724,36686,6598,9637,Music,2017,November,11,Wednesday,17
_qSW96a2aKY,Keith Urban - Female (Official Audio),Keith Urban,878560,12961,1468,1788,Entertainment,2017,November,11,Wednesday,5
2VP846QcA_4,I Trained To Become Batman 🦇 (Justice League),Michelle Khare,155533,4621,233,451,Entertainment,2017,November,11,Thursday,11
lsfzA7sWlOM,L.A. Noire - Nintendo Switch Trailer,Nintendo,161231,7803,169,1479,Gaming,2017,November,11,Thursday,19
X7flefV8tec,"President Bill Clinton On Dictators, Democracy, & Why We Need Immigrants More Than Ever",Team Coco,379918,4472,4507,2066,Entertainment,2017,November,11,Thursday,2
l7je4VAUvjA,World's First Engagement Ring Phone Case,Caters Clips,90454,211,65,59,News & Politics,2017,November,11,Friday,8
eHIY3HNNqzM,The Script - Arms Open (Acoustic) [Audio],TheScriptVEVO,157037,7800,96,326,Music,2017,November,11,Friday,8
5gFpcEKayz4,MØ - When I Was Young (Official Video),MOMOMOYOUTHVEVO,895507,38734,550,1270,Music,2017,November,11,Thursday,9
r96KpNTcog4,THE MOMENTS BETWEEN THE MONTAGE | Chris & Jack,Chris and Jack,134372,7979,80,310,Comedy,2017,November,11,Thursday,14
6Detw08jRhs,MDNA SKIN: Express Yourself,MDNA SKIN,55901,477,132,105,People & Blogs,2017,November,11,Thursday,18
_CJN_ryETIY,Harry Styles canta Sign Of The Times a X Factor Italia - Live Show 3,X Factor Italia,207678,10372,69,554,Entertainment,2017,November,11,Thursday,23
sottGW1p5os,P!nk Carpool Karaoke,The Late Late Show with James Corden,3621389,141681,1289,8127,Entertainment,2017,November,11,Wednesday,6
_BVAJ3PXZ1k,The all-American fruit you've probably never heard of,Vox,533940,12633,597,1828,News & Politics,2017,November,11,Wednesday,11
8hKbIhrb1WU,Kim Kardashian Lets Gender of Third Child Slip,TheEllenShow,1559003,29898,884,1838,Entertainment,2017,November,11,Wednesday,14
RTaDvKMtUeA,Larry David Outtakes – Mean Tweets About Jimmy Kimmel,Jimmy Kimmel Live,760341,13283,317,433,Entertainment,2017,November,11,Wednesday,5
gjXrm2Q-te4,Jimmy Fallon Pays Tribute to His Mother Gloria,The Tonight Show Starring Jimmy Fallon,2223948,76806,1169,4176,Comedy,2017,November,11,Tuesday,4
kgaO45SyaO4,The New SpotMini,BostonDynamics,5531707,72727,3362,14816,Science & Technology,2017,November,11,Monday,20
9Ca8zWJOlFQ,Apple iPhone X Review: The Best Yet!,Marques Brownlee,1825705,77531,4156,12025,Science & Technology,2017,November,11,Wednesday,2
oRF2-ZloSqg,"AJ Styles & Daniel Bryan warn Brock Lesnar about what awaits him: SmackDown LIVE, Nov. 14, 2017",WWE,845763,17929,502,2325,Sports,2017,November,11,Wednesday,2
lzgQrHFDNLE,What Does A Cochlear Implant Sound Like?,SciShow,177648,6932,786,697,Education,2017,November,11,Tuesday,22
KJ12FVmumeA,Stephen A. Smith: Jay Cutler is a 'disease' | First Take | ESPN,ESPN,281868,1546,245,885,Sports,2017,November,11,Tuesday,16
815lSYphlbw,Japanese Food Tour with Frank Pinello and Sakura Yagi | Sean in the Wild,First We Feast,196434,6305,88,762,Howto & Style,2017,November,11,Tuesday,16
64IIfxDrhJY,Titanic (2017) - Dolby Vision Trailer,Paramount Pictures,17129,455,18,101,Film & Animation,2017,November,11,Wednesday,13
ryqZUqgjvW8,Justice League - Movie Review Is It What We've Been Waiting For?,ColliderVideos,90641,2349,409,1246,Entertainment,2017,November,11,Wednesday,7
3x0usYgljOk,"Jayson Tatum Full Highlights 2017.11.14 at Nets - 19 Pts, 3 Stls, SMOOTH!",FreeDawkins,12494,252,3,91,Sports,2017,November,11,Wednesday,5
SGVbdo2CkgI,Victoria Beckham Gives Strangers Fashion Advice for $2 in Central Park | Vanity Fair,Vanity Fair,30341,730,22,34,Entertainment,2017,November,11,Tuesday,13
KhdecX0qjNA,Demi Lovato - Sorry Not Sorry in the Live Lounge,BBCRadio1VEVO,157522,8012,85,286,Music,2017,November,11,Monday,20
i-LCORFB860,'Lightning Strike' B777-300 on departure @ KL743 // PH-BVS,Valk Aviation,1037561,716,117,223,Travel & Events,2017,November,11,Monday,9
symdi5KSJts,Model Fei Fei Sun Perform Skin-Care Magic | Beauty Secrets | Vogue,Vogue,212992,7049,209,365,Entertainment,2017,November,11,Tuesday,13
5hEJsoDP2q4,"Justice League | “Come Together” | Todrick Hall, J.Fla, Mario Bautista, Samantha Harvey, Clara Marz",todrickhall,209442,19069,289,836,Entertainment,2017,November,11,Tuesday,17
qC0I5PEhkJo,The perfect ice - Ice boats on Lake Geneva,MattMasonPhotography,99999,143,12,32,Sports,2010,January,1,Thursday,15
MNiweoKXwfg,Watch Norman Reedus Come Face to Face with his ‘Walking Dead’ Double,INSIDER,20529,318,11,41,Entertainment,2017,November,11,Monday,17
JBZTZZAcFTw,"What $4,800 Will Get You In NYC | Sweet Digs Home Tour | Refinery29",Refinery29,237111,2323,786,636,Howto & Style,2017,November,11,Sunday,16
9XSULcLI6Hg,Kellyanne Conway on Roy Moore This Week Abc: Trump’s Not Being Briefed On This Bit By Bit 11/12/17,JimBrowski 96HourNews,36859,23,10,135,News & Politics,2017,November,11,Sunday,15
pjuPpVLXDQg,Train Swipes Parked Vehicle,ViralHog,100120,154,15,48,Autos & Vehicles,2017,November,11,Monday,0
0PpNlNJ6Nng,Will It Watermarble?! Sister Edition | Watermarbling 9 random objects in nail polish!,Simply Nailogical,2083918,106243,1461,12707,Entertainment,2017,November,11,Saturday,19
9KIP-Ncp2jU,Bill Gates bought land in Arizona to build tech city,12 News,92327,182,45,0,People & Blogs,2017,November,11,Saturday,1
4v0nOAzcG2A,The Super Google Pixel 2 Camera Upgrade!,Jonathan Morrison,300601,10497,382,991,Science & Technology,2017,November,11,Saturday,15
8mhTWqWlQzU,Wearing Online Dollar Store Makeup For A Week,Safiya Nygaard,3031863,121285,1186,6852,People & Blogs,2017,November,11,Saturday,1
i4YQRLQVixM,How Bkav tricked iPhone X's Face ID with a mask,Bkav Corp,1167646,2691,916,1122,Science & Technology,2017,November,11,Friday,7
1cgK-BIrXes,#VeteransDay: Thank You for Everything,YouTube Spotlight,849499,27121,2042,5181,Entertainment,2017,November,11,Friday,15
_Iz83-Cmt6A,Little Big Town with Jimmy Webb - Wichita Lineman (Live from the CMA Awards),CMAVEVO,58135,519,69,65,Music,2017,November,11,Thursday,22
2Vv-BfVoq4g,Ed Sheeran - Perfect (Official Music Video),Ed Sheeran,43449654,1788960,24548,93428,Music,2017,November,11,Thursday,11
gLswXiRLdkA,A VERY #EXTRA EBAY SHOPPING HAUL!,Amber Scholl,525210,24412,1259,1847,Howto & Style,2017,November,11,Saturday,2
MyEqfBkzESU,EXTREME GOLDEN TAN TRANSFORMATION,John Maclean,390261,9474,3091,3207,Howto & Style,2017,November,11,Friday,20
OKoL852K9uA,ICE PRIMER? DOES IT WORK?!,mayratouchofglam,122772,3912,298,403,Howto & Style,2017,November,11,Saturday,5
-OK9i1_YYYc,Animal Adventure Park Giraffe Cam,Animal Adventure Park,46260,2286,35,17,Pets & Animals,2017,November,11,Sunday,0
pa_oUisZZy0,Mark Ruffalo Reads Hilarious Thirst Tweets,BuzzFeed Celeb,243412,7782,104,340,People & Blogs,2017,November,11,Saturday,0
G8gJ4RTBxcg,Coconut crab hunts seabird,New Scientist,465893,111,14,59,Science & Technology,2017,November,11,Thursday,15
UFYCTJlayS4,Top 10 iPhone Apps for Productivity & Content Creation,Sara Dietschy,59168,2412,193,274,Film & Animation,2017,November,11,Saturday,3
cccyOn99s4Y,Reacting to Running a Half Marathon | MEGANBYTES EP. 101,MeganBatoon,82713,3124,151,250,Entertainment,2017,November,11,Friday,23
arJ5h2TY3I4,FANTASY (feat. Amber Liu) by SUPERFRUIT,SUPERFRUIT,1233722,115781,1615,9706,Entertainment,2017,November,11,Friday,17
-2RVw2_QyxQ,2017 Champions Showdown: Day 3,Saint Louis Chess Club,71089,460,27,20,Education,2017,November,11,Sunday,2
uTH--XRCGxM,5 Strange Things That Happened to Stranger Things’ Joe Keery on His GQ Photo Shoot,GQ,127404,3869,56,111,Entertainment,2017,November,11,Friday,17
xfmipNU4Odc,Edna's registered owner thought she was dead for 2 years!!!,Hope For Paws - Official Rescue Channel,339256,17267,85,948,Pets & Animals,2017,November,11,Friday,18
e4FApt6z55c,Kimbra - Top of the World (Official Music Video),kimbramusic,226659,9725,400,1027,Music,2017,November,11,Friday,15
RkHuWjiR-LM,Neck Deep - Parachute (Official Music Video),Hopeless Records,241314,15071,186,1011,Music,2017,November,11,Friday,18
2XK4omx9uMU,Camila Cabello COMPLETELY NAILS 'Finish The Lyric',Capital FM,1354030,57838,512,1257,Music,2017,November,11,Friday,14
abGCYPCk294,"Justice League Reactions, Should Disney Buy Netflix - The John Campea Show",John Campea,45236,1581,110,911,Entertainment,2017,November,11,Saturday,17
AJYb0Yom5UQ,Howard Stern: George Takei Talks About Harvey Weinstein and Sexually Assault,cocheusadoooo,172587,379,49,199,Comedy,2017,October,10,Tuesday,20
fNtLIcyjsnI,"Game Night Official Trailer #1 (2018) Rachel McAdams, Jason Bateman Comedy Movie HD",Zero Media,2122489,20085,1104,1321,Film & Animation,2017,November,11,Thursday,17
b4vTZx_AtHk,How To Dry a Shirt in 30 Seconds,HowToBasic,2291077,102726,12794,11941,Howto & Style,2017,November,11,Thursday,18
YlvCVbfS9M0,Alan Walker - All Falls Down (Behind The Scenes),Alan Walker,935744,37129,622,2673,Music,2017,November,11,Saturday,15
DIU3xPdhCBI,Sam Smith surprises brides at their wedding! (At The BBC),BBC Music,1262652,28119,1047,1113,Music,2017,November,11,Thursday,22
Fyyua5JzD9w,Baby loves Jeopardy!,Daelric,49915,386,11,24,People & Blogs,2017,November,11,Friday,17
QFfEtKvXMAs,Niall Horan - Too Much To Ask (Acoustic),NiallHoranVEVO,505794,55628,192,3033,Music,2017,November,11,Friday,17
jp9hK-jY6yY,When Someone Has A Crush on You | Lilly Singh,IISuperwomanII,3680540,216119,3570,20544,Comedy,2017,November,11,Thursday,22
lJFqvRwOiis,Walking while black,Vox,505886,23207,5375,7030,News & Politics,2017,November,11,Thursday,12
vKbyfdJXoDg,Jordan Peele Crashed A 'Get Out' College Course,The Late Show with Stephen Colbert,406769,6593,397,1253,Entertainment,2017,November,11,Thursday,8
eDelIZDzmwQ,Blake Shelton Is Milking His Title of Sexiest Man Alive,TheEllenShow,340348,5474,372,653,Entertainment,2017,November,11,Thursday,14
t1Liix4gi7k,Gigi Hadid Gives Jimmy the Only Men's Pair of Her EyeLoveMore Mules,The Tonight Show Starring Jimmy Fallon,1035804,18816,737,1133,Comedy,2017,November,11,Thursday,5
oMupq6zB1Tc,Should Hillary Clinton Be Impeached?,Jimmy Kimmel Live,769769,6133,1124,2837,Entertainment,2017,November,11,Wednesday,8
TN5jzDgORqQ,KUWTK | Kris Jenner Brings Her Personal Scribe to Lunch | E!,E! Entertainment,325333,2750,307,383,Entertainment,2017,November,11,Wednesday,15
4SANXNco_y4,Dashboard Confessional: We Fight (Official Audio),Fueled By Ramen,82048,3539,144,347,Music,2017,November,11,Wednesday,17
UC34HrZhfPM,"Kyle Kuzma Full Highlights 2017.11.15 vs 76ers - 24 Pts, 7 Rebs!",FreeDawkins,23429,365,10,188,Sports,2017,November,11,Thursday,6
IKuKZIISPE0,Behind The Curtain - OFFICIAL TRAILER,todrickhall,69199,4237,15,220,Entertainment,2017,November,11,Wednesday,17
KOUxLhYVgGw,Rosé Facial in New York City,INSIDER,6582,174,8,22,Howto & Style,2017,November,11,Thursday,20
dnA3Cd5xG5A,How Maybelline Mascara Is Made | How Stuff Is Made | Refinery29,Refinery29,22383,921,26,78,Howto & Style,2017,November,11,Wednesday,16
yZGSIpcAfEo,Willie Reed and Joel Embiid Fight！Embiid saying HE CANT FUCKIN GUARD ME!,DunkFest,80687,197,30,53,Sports,2017,November,11,Tuesday,4
ijJPFowBsBc,HUGE BEAUTY FAVOURITES! AUTUMN LOVES!,Estée Lalonde,141308,4455,169,327,People & Blogs,2017,November,11,Sunday,17
